question;predicate
Where did john vi kantakouzenos die?;http://dbpedia.org/ontology/deathPlace
what was ed van der elsken's place of death;http://dbpedia.org/ontology/deathPlace
What is the nae of an interactive fiction game;http://dbpedia.org/ontology/genre
who produced gundamma katha?;http://dbpedia.org/ontology/producer
What is the place of birth of Jorge Rinaldi?;http://dbpedia.org/ontology/birthPlace
What is the birth place of vernon e. megee?;http://dbpedia.org/ontology/birthPlace
what county is washington pass a part;http://dbpedia.org/ontology/location
what is a rock music artist that plays drums;http://dbpedia.org/ontology/genre
who was the exquisite cadaver directed by;http://dbpedia.org/ontology/director
claudemir ferreira da silva plays what position?;http://dbpedia.org/ontology/position
is daviddevantandhisspiritwife indie rock or classical;http://dbpedia.org/ontology/genre
what type of music is played in LP airshow;http://dbpedia.org/ontology/genre
where was goichi suda born;http://dbpedia.org/ontology/birthPlace
where was dawa narbula born;http://dbpedia.org/ontology/birthPlace
What is a film that was written by lawrence kasdan;http://dbpedia.org/ontology/writer
Where was aboobaker osman mitha born;http://dbpedia.org/ontology/birthPlace
what city and state did  jerry wallace pass away;http://dbpedia.org/ontology/deathPlace
which country is eufemio cabral from;http://dbpedia.org/ontology/birthPlace
where did Emile danoen die;http://dbpedia.org/ontology/deathPlace
what kind of music is played in dizzy heights;http://dbpedia.org/ontology/genre
Name a mystery novel by Douglas Adams.;http://dbpedia.org/ontology/literaryGenre
Which artist is on the london records label?;http://dbpedia.org/ontology/recordLabel
what is matt angle  baseball position;http://dbpedia.org/ontology/position
what is august starek's professional position;http://dbpedia.org/ontology/position
Name a punk rock artist.;http://dbpedia.org/ontology/genre
What is the name of a game from the racing game genre;http://dbpedia.org/ontology/genre
Where was gaetan bussmann born;http://dbpedia.org/ontology/birthPlace
what bob dylan songs did he write;http://dbpedia.org/ontology/writer
Model hiromi oshima was born in this large city in Japan.;http://dbpedia.org/ontology/birthPlace
who produced lisbon story?;http://dbpedia.org/ontology/producer
where did the band current swell form;http://dbpedia.org/ontology/hometown
which baseball position is played by stump wiedman;http://dbpedia.org/ontology/position
what are popular music albums;http://dbpedia.org/ontology/genre
what is the nationality of khan abdul wali khan;http://dbpedia.org/ontology/birthPlace
Who's a princess born in the grand palace;http://dbpedia.org/ontology/birthPlace
where did valerie june get her start;http://dbpedia.org/ontology/hometown
what position does isaac curtis play in football?;http://dbpedia.org/ontology/position
what type of music is dust bowl?;http://dbpedia.org/ontology/genre
Where was marcel hillaire born?;http://dbpedia.org/ontology/birthPlace
Which time zone is lafayette located in;http://dbpedia.org/ontology/timeZone
Name a person born in oakland.;http://dbpedia.org/ontology/birthPlace
Where was james vaughan born;http://dbpedia.org/ontology/birthPlace
What kind of book is the spare room;http://dbpedia.org/ontology/literaryGenre
Julian cope wrote the lyrics for what song?;http://dbpedia.org/ontology/writer
What is an example of a dance music album?;http://dbpedia.org/ontology/genre
Name the biography written by Milton Meltzer?;http://dbpedia.org/ontology/literaryGenre
what music genre is protest songs;http://dbpedia.org/ontology/genre
where is cmx originally from;http://dbpedia.org/ontology/hometown
what kind of book is more than human;http://dbpedia.org/ontology/literaryGenre
What position did chico fernandez play?;http://dbpedia.org/ontology/position
Which artist is in the music genre of rock?;http://dbpedia.org/ontology/genre
Which city was george etherege when he died;http://dbpedia.org/ontology/deathPlace
which fantasy books are written by troy denning?;http://dbpedia.org/ontology/literaryGenre
who wrote ibiza bar;http://dbpedia.org/ontology/writer
Which country is ashley torres from;http://dbpedia.org/ontology/birthPlace
where was walther bauersfeld given birth to;http://dbpedia.org/ontology/birthPlace
What genre of music is our cubehouse still rocks?;http://dbpedia.org/ontology/genre
what nationality is kevin harrington;http://dbpedia.org/ontology/birthPlace
what category of game is amped 2 under;http://dbpedia.org/ontology/genre
Where was paul hymans born;http://dbpedia.org/ontology/birthPlace
what position did mykola pavlov play?;http://dbpedia.org/ontology/position
Which position did charlie brown play?;http://dbpedia.org/ontology/position
Who was born in mankato?;http://dbpedia.org/ontology/birthPlace
what sort of music is i can wonder what you did with your day;http://dbpedia.org/ontology/genre
Which language is jaka sembung in;http://dbpedia.org/ontology/language
what is the genre of stacked rubbish by the gazette;http://dbpedia.org/ontology/genre
what state was melora hardin born;http://dbpedia.org/ontology/birthPlace
what type of book is the republic of wine;http://dbpedia.org/ontology/literaryGenre
what king of video game is metal gear acid 2?;http://dbpedia.org/ontology/genre
what is one of gene brewer's works;http://dbpedia.org/ontology/author
where was maxine moul's birthplace;http://dbpedia.org/ontology/birthPlace
where did philopoemen die;http://dbpedia.org/ontology/deathPlace
Which label is the artist the darkness on;http://dbpedia.org/ontology/recordLabel
Where does lord wind hail from?;http://dbpedia.org/ontology/birthPlace
under what label does lower definition work;http://dbpedia.org/ontology/recordLabel
where was reba z. whittle born;http://dbpedia.org/ontology/birthPlace
which musician is hip hop;http://dbpedia.org/ontology/genre
which film did yukihiko tsutsumi direct;http://dbpedia.org/ontology/director
what type of music is drottnar;http://dbpedia.org/ontology/genre
What type of music does kirka write?;http://dbpedia.org/ontology/genre
Who is an artist that is signed to atlantic records;http://dbpedia.org/ontology/recordLabel
where did evelyn kozak pass away;http://dbpedia.org/ontology/deathPlace
what is a disco album;http://dbpedia.org/ontology/genre
which artist performs in the gothic rock genre;http://dbpedia.org/ontology/genre
what kind of book is captives of the flame;http://dbpedia.org/ontology/literaryGenre
who directed the almost famous movie;http://dbpedia.org/ontology/director
Which position does bob obrien play;http://dbpedia.org/ontology/position
Which label signed b-projekt?;http://dbpedia.org/ontology/recordLabel
what genre of pop is the album getting away with it... live;http://dbpedia.org/ontology/genre
what artists are with emi?;http://dbpedia.org/ontology/recordLabel
What is bill jones's place of death?;http://dbpedia.org/ontology/deathPlace
Name an album from the heavy metal genre;http://dbpedia.org/ontology/genre
what film did roger corman produce;http://dbpedia.org/ontology/producer
What time zone is used in loogootee, indiana;http://dbpedia.org/ontology/timeZone
what position on the field does damien tixier play;http://dbpedia.org/ontology/position
what type of game genre was rollcage;http://dbpedia.org/ontology/genre
Where was hiroki takahashi born;http://dbpedia.org/ontology/birthPlace
what is the position of the baseball player vladimir guerrero;http://dbpedia.org/ontology/position
what computer videogame genre is championship manager 93/94;http://dbpedia.org/ontology/genre
who is the story of a far off place accredited to;http://dbpedia.org/ontology/writer
Name an irish painter born in dublin;http://dbpedia.org/ontology/birthPlace
where was elisabeth of bavaria, queen of germany born;http://dbpedia.org/ontology/birthPlace
Name a historic hotel located in dearborn.;http://dbpedia.org/ontology/location
What kind of book is seeds of yesterday?;http://dbpedia.org/ontology/literaryGenre
Where did fakhr ad-din ar-razi die?;http://dbpedia.org/ontology/deathPlace
which musician was born in elkhart;http://dbpedia.org/ontology/birthPlace
leni riefenstahl  directed what film;http://dbpedia.org/ontology/director
who is a politician from prilep?;http://dbpedia.org/ontology/birthPlace
What is the name of a soundtrack album?;http://dbpedia.org/ontology/genre
Where was buddy feyne born?;http://dbpedia.org/ontology/birthPlace
Name a novel;http://dbpedia.org/ontology/literaryGenre
is freddy juarez from the united states or mexico;http://dbpedia.org/ontology/birthPlace
who was born in nanty glo;http://dbpedia.org/ontology/birthPlace
What are some lyrics that were written by tori amos;http://dbpedia.org/ontology/writer
where in the midwest is bobby joe hill's place of death?;http://dbpedia.org/ontology/birthPlace
What genre of music is the album ella in london?;http://dbpedia.org/ontology/genre
what language do filipino people of spanish ancestry speak;http://dbpedia.org/ontology/language
where did james brice pass away;http://dbpedia.org/ontology/deathPlace
Where was jb gill born;http://dbpedia.org/ontology/birthPlace
where was miroslav holub born;http://dbpedia.org/ontology/birthPlace
who was born in longmeadow, massachusetts?;http://dbpedia.org/ontology/birthPlace
which artist is known for jazz fusion;http://dbpedia.org/ontology/genre
What kind of metal is played on thrash anthems;http://dbpedia.org/ontology/genre
what kind of music is sex pistols recognized for;http://dbpedia.org/ontology/genre
what is  alain dorvals place of birth;http://dbpedia.org/ontology/birthPlace
Which British football player was born in basingstoke;http://dbpedia.org/ontology/birthPlace
What time zone does the chebanse township use;http://dbpedia.org/ontology/timeZone
what genre of music is razorblade suitcase categorized as;http://dbpedia.org/ontology/genre
danny devito  was the director for what film;http://dbpedia.org/ontology/director
What famous drummer from Pink Floyd is signed to emi?;http://dbpedia.org/ontology/recordLabel
Where was les mills born?;http://dbpedia.org/ontology/birthPlace
what tv program is classified as a  sitcom;http://dbpedia.org/ontology/genre
where is citibank hall?;http://dbpedia.org/ontology/location
what kind of program is comedy central roast?;http://dbpedia.org/ontology/genre
whats the genre of the album motion sickness: live recordings;http://dbpedia.org/ontology/genre
What is an example of traditional pop music album?;http://dbpedia.org/ontology/genre
Name a film produced by michael balcon;http://dbpedia.org/ontology/producer
which position does w. g. richardson play;http://dbpedia.org/ontology/position
which time zone is moose lake a part of;http://dbpedia.org/ontology/timeZone
what is the name of a travel book?;http://dbpedia.org/ontology/literaryGenre
where is saint john's evangelical lutheran church;http://dbpedia.org/ontology/location
What is the language in the film andrine og kjell;http://dbpedia.org/ontology/language
Name a mystery book.;http://dbpedia.org/ontology/literaryGenre
Who produced the film five star final?;http://dbpedia.org/ontology/producer
Who's a second baseman born in san pedro de macoris;http://dbpedia.org/ontology/birthPlace
What is an album from the metalcore genre;http://dbpedia.org/ontology/genre
Where in europe was edele lynch born;http://dbpedia.org/ontology/birthPlace
who are alternative rock artists;http://dbpedia.org/ontology/genre
which actor was born in chicago?;http://dbpedia.org/ontology/birthPlace
what north american nationality is brendan meyer;http://dbpedia.org/ontology/birthPlace
who produced the film  the purple plain;http://dbpedia.org/ontology/producer
Who firected the film 1999;http://dbpedia.org/ontology/director
What nation is fredrik thordendal originally from?;http://dbpedia.org/ontology/hometown
Where was alex stokes born?;http://dbpedia.org/ontology/birthPlace
Who was born in rio de janeiro?;http://dbpedia.org/ontology/birthPlace
What football position does ray drew play;http://dbpedia.org/ontology/position
What language is into thin air in?;http://dbpedia.org/ontology/language
Who was born in santa monica, california?;http://dbpedia.org/ontology/birthPlace
which south american country does thiago martins belong to?;http://dbpedia.org/ontology/birthPlace
what language do dai people speak;http://dbpedia.org/ontology/language
What is an example of a debut punk rock album;http://dbpedia.org/ontology/genre
what south american country is  diogo fernandes from;http://dbpedia.org/ontology/birthPlace
what greater los angeles city is the origin of alan o'day;http://dbpedia.org/ontology/birthPlace
was andrea guerra a playmaker or defender on the pitch;http://dbpedia.org/ontology/position
Which state in mexico did ambrose bierce pass away;http://dbpedia.org/ontology/deathPlace
As what genre is punjabi by nature classified?;http://dbpedia.org/ontology/genre
where was adele goldberg born;http://dbpedia.org/ontology/birthPlace
which british author was originally from ipswich;http://dbpedia.org/ontology/birthPlace
What football position does clifton sandvliet play?;http://dbpedia.org/ontology/position
which position does dieter kochan play;http://dbpedia.org/ontology/position
who is the lyricist of the song the district sleeps alone tonight?;http://dbpedia.org/ontology/writer
What genre is prints of darkness;http://dbpedia.org/ontology/genre
what kind of music does ainhoa cantalapiedra make;http://dbpedia.org/ontology/genre
who is the executive producer of california solo;http://dbpedia.org/ontology/producer
What is carl thomas anderson's nationality?;http://dbpedia.org/ontology/birthPlace
Where was andrew finlay born?;http://dbpedia.org/ontology/birthPlace
Name an artist at kranky records;http://dbpedia.org/ontology/recordLabel
where did adelle davis pass way;http://dbpedia.org/ontology/deathPlace
what genre of music is catfights and spotlights under?;http://dbpedia.org/ontology/genre
What style of music does edsilia rombley sing?;http://dbpedia.org/ontology/genre
Who is someone that was born in beijing;http://dbpedia.org/ontology/birthPlace
What language does james still speak?;http://dbpedia.org/ontology/language
Name a country album;http://dbpedia.org/ontology/genre
Artist shark island creates this music.;http://dbpedia.org/ontology/genre
which US city is zachary taylor house located;http://dbpedia.org/ontology/location
Where was chuck coles born;http://dbpedia.org/ontology/hometown
What language was ronquillo filmed in?;http://dbpedia.org/ontology/language
where was tom kain born;http://dbpedia.org/ontology/birthPlace
what is the origin of ben allison?;http://dbpedia.org/ontology/birthPlace
What Genre is the album, Modern Pain, classified as?;http://dbpedia.org/ontology/genre
Who produced the film luke and the mermaids?;http://dbpedia.org/ontology/producer
Who is a center back born is ilkeston;http://dbpedia.org/ontology/birthPlace
what type of genre does billy yates play in?;http://dbpedia.org/ontology/genre
what is the origin of erika van pelt?;http://dbpedia.org/ontology/hometown
what country is ariel salinas form;http://dbpedia.org/ontology/birthPlace
Name someone who was born in arlington county;http://dbpedia.org/ontology/birthPlace
what city was joris sainati  born;http://dbpedia.org/ontology/birthPlace
which language is used in priyasakhi;http://dbpedia.org/ontology/language
where did cai e die;http://dbpedia.org/ontology/deathPlace
what kind of artist is bertie higgins;http://dbpedia.org/ontology/genre
what type of game is race driver: grid;http://dbpedia.org/ontology/genre
who wrote the film wings of desire;http://dbpedia.org/ontology/writer
what artists are signed with earache records?;http://dbpedia.org/ontology/recordLabel
What label did elize sign to?;http://dbpedia.org/ontology/recordLabel
what label does  rory block record under;http://dbpedia.org/ontology/recordLabel
which tv program is animation;http://dbpedia.org/ontology/genre
what type of music does kassav perform?;http://dbpedia.org/ontology/genre
What's a death metal band on ferret music;http://dbpedia.org/ontology/recordLabel
which movie was written by drew goddard;http://dbpedia.org/ontology/writer
which category is the romulan way often put under;http://dbpedia.org/ontology/literaryGenre
What's a song written by jerry cantrell;http://dbpedia.org/ontology/writer
which genre is the book the house on the borderland;http://dbpedia.org/ontology/literaryGenre
what is toshio sugie's place of birth;http://dbpedia.org/ontology/birthPlace
Which presidential son was born in st. louis?;http://dbpedia.org/ontology/birthPlace
what style of music does gillespiana play;http://dbpedia.org/ontology/genre
what genre is so romantic;http://dbpedia.org/ontology/genre
What position does frostee rucker play?;http://dbpedia.org/ontology/position
what position does andrew alberts play in hockey;http://dbpedia.org/ontology/position
what is afi's record label;http://dbpedia.org/ontology/recordLabel
what kind of music does paolo zavallone like;http://dbpedia.org/ontology/genre
who wrote the film king ralph;http://dbpedia.org/ontology/writer
what genre is the artist korey cooper;http://dbpedia.org/ontology/genre
what is martin andreas udbye's place of death?;http://dbpedia.org/ontology/deathPlace
What is the title of a composition by john mcgeoch;http://dbpedia.org/ontology/writer
what genre is modesty blaise;http://dbpedia.org/ontology/literaryGenre
where did william standish knowles's life start;http://dbpedia.org/ontology/birthPlace
which book was written by laurence olivier;http://dbpedia.org/ontology/author
what type of music does vince hornsby make;http://dbpedia.org/ontology/genre
who was the writer of the tv episode the game;http://dbpedia.org/ontology/writer
what was earle birney's birth place;http://dbpedia.org/ontology/birthPlace
Name a biographical book in the early 20th century.;http://dbpedia.org/ontology/literaryGenre
thomas pinckney passed away in this South Carolina city.;http://dbpedia.org/ontology/deathPlace
what is the position of peter hampton;http://dbpedia.org/ontology/position
what is a work by john phillips;http://dbpedia.org/ontology/writer
Where was jadon lavik born;http://dbpedia.org/ontology/birthPlace
which book is fiction;http://dbpedia.org/ontology/literaryGenre
which film did vipul amrutlal shah write;http://dbpedia.org/ontology/writer
What kind of music is featured on ten new songs;http://dbpedia.org/ontology/genre
where did jim kjelgaard die?;http://dbpedia.org/ontology/deathPlace
nicky bomba was known for what type of music;http://dbpedia.org/ontology/genre
what music genre is mike o'neill;http://dbpedia.org/ontology/genre
name a county and state under the north american central time zone;http://dbpedia.org/ontology/timeZone
what type of music associated with the southern part of the Indian is performed by annamacharya;http://dbpedia.org/ontology/genre
Which position in football does barrett jones play;http://dbpedia.org/ontology/position
Name a country music song from the 2011 single by Alan Jackson.;http://dbpedia.org/ontology/genre
what kinds of music is created by the eyeliners;http://dbpedia.org/ontology/genre
who produced block busters?;http://dbpedia.org/ontology/producer
what kind of album is hephaestus?;http://dbpedia.org/ontology/genre
What drama was broadcast on ABC?;http://dbpedia.org/ontology/genre
Who authored more than human?;http://dbpedia.org/ontology/author
what album by coroner is thrash metal;http://dbpedia.org/ontology/genre
what kind of music is on the great escape?;http://dbpedia.org/ontology/genre
what is the name of a film that charles walters directed?;http://dbpedia.org/ontology/director
what is roscoe bartletts birth place;http://dbpedia.org/ontology/birthPlace
what musical ensemble is nat towles from;http://dbpedia.org/ontology/genre
Who executively produced the crying game;http://dbpedia.org/ontology/producer
what is a book in the essay genre;http://dbpedia.org/ontology/literaryGenre
Where exactly was marian golinski born;http://dbpedia.org/ontology/birthPlace
what type of music does mark howard play;http://dbpedia.org/ontology/genre
where is camellatimer from;http://dbpedia.org/ontology/hometown
Where in pennsylvania was christian martucci born;http://dbpedia.org/ontology/hometown
Name an album from the art rock genre;http://dbpedia.org/ontology/genre
which musician recorded the end records;http://dbpedia.org/ontology/recordLabel
who composed believe;http://dbpedia.org/ontology/writer
What footballer was born in county tyrone?;http://dbpedia.org/ontology/birthPlace
what is the language spoken in palletoori monagadu?;http://dbpedia.org/ontology/language
who produced cruel intentions;http://dbpedia.org/ontology/producer
what state is wells fargo center in?;http://dbpedia.org/ontology/location
where did juan antonio lavalleja's life end?;http://dbpedia.org/ontology/deathPlace
Who wrote dil chahta hai;http://dbpedia.org/ontology/writer
What kind of tv program is frasier?;http://dbpedia.org/ontology/genre
What album is from the rock music genre?;http://dbpedia.org/ontology/genre
Which label is sean kingston signed to;http://dbpedia.org/ontology/recordLabel
WHat genre does danko jones make;http://dbpedia.org/ontology/genre
Who is an indie rock artist;http://dbpedia.org/ontology/genre
What is Danny Maguires position in football?;http://dbpedia.org/ontology/position
what position did stanislav Sestak play?;http://dbpedia.org/ontology/position
What indian writer was born in india?;http://dbpedia.org/ontology/birthPlace
What genre of videogame is clash of steel?;http://dbpedia.org/ontology/genre
Where was george edwin king born?;http://dbpedia.org/ontology/birthPlace
Where was baldev raj chopra born;http://dbpedia.org/ontology/birthPlace
what artist performs reggae music?;http://dbpedia.org/ontology/genre
which attraction is located in pattaya;http://dbpedia.org/ontology/location
Who is an individual that was born in paris;http://dbpedia.org/ontology/birthPlace
which picture book is written by lane smith?;http://dbpedia.org/ontology/literaryGenre
What is a popular fiction book;http://dbpedia.org/ontology/literaryGenre
What  genre of music does daddy dj create;http://dbpedia.org/ontology/genre
what kind of music is on the album we've come for you all;http://dbpedia.org/ontology/genre
what type of music does bright ideas make;http://dbpedia.org/ontology/genre
What film was directed by hrishikesh mukherjee?;http://dbpedia.org/ontology/director
what is the genre of dare to be stupid;http://dbpedia.org/ontology/genre
what kind of game is swords & soldiers?;http://dbpedia.org/ontology/genre
Where was clifford ulp when he was born;http://dbpedia.org/ontology/birthPlace
what kind of video game is warcraft iii: the frozen throne;http://dbpedia.org/ontology/genre
what city did walter blair pass away;http://dbpedia.org/ontology/deathPlace
what label is eddie hazel with?;http://dbpedia.org/ontology/recordLabel
what city and state did  john mccarthy die;http://dbpedia.org/ontology/deathPlace
where is robert weygand originally from;http://dbpedia.org/ontology/birthPlace
where did johnny gruelle die;http://dbpedia.org/ontology/deathPlace
which city was jonah matranga from;http://dbpedia.org/ontology/hometown
The director of american soldiers was?;http://dbpedia.org/ontology/director
what position does the football player tommy reasoner play in?;http://dbpedia.org/ontology/position
what is stewart walter loudoun-shand's nationality;http://dbpedia.org/ontology/birthPlace
What type of music does kvitretten write;http://dbpedia.org/ontology/genre
who was born in california?;http://dbpedia.org/ontology/birthPlace
Where was mykola livytskyi born?;http://dbpedia.org/ontology/birthPlace
what kind of country music is on the album at the end of paths taken;http://dbpedia.org/ontology/genre
Where was robert gober born;http://dbpedia.org/ontology/birthPlace
What type of show is hole in the wall?;http://dbpedia.org/ontology/genre
who wrote the film 7 khoon maaf?;http://dbpedia.org/ontology/writer
whats an example of a hard rock album;http://dbpedia.org/ontology/genre
What genre is the program four feather falls;http://dbpedia.org/ontology/genre
who is an artist with roadrunner records?;http://dbpedia.org/ontology/recordLabel
what is an album in pop music;http://dbpedia.org/ontology/genre
which country was sireli bobo born in;http://dbpedia.org/ontology/birthPlace
Where did proof (rapper) pass away?;http://dbpedia.org/ontology/deathPlace
what type of music is directors cut?;http://dbpedia.org/ontology/genre
where did hibari misora die;http://dbpedia.org/ontology/deathPlace
who was born a seattle;http://dbpedia.org/ontology/birthPlace
What soccer position does marcus haber play;http://dbpedia.org/ontology/position
what kind off book is upon some midnights clear;http://dbpedia.org/ontology/literaryGenre
what time zone does gilmore belong to;http://dbpedia.org/ontology/timeZone
what type of music can be found by listening to the album two rainy nights: live in the northwest;http://dbpedia.org/ontology/genre
Which position does charlie harding play;http://dbpedia.org/ontology/position
which artist performs in the electronic dance music genre;http://dbpedia.org/ontology/genre
where was pekka haavisto born;http://dbpedia.org/ontology/birthPlace
who is a catcher;http://dbpedia.org/ontology/position
what record label worked with local h;http://dbpedia.org/ontology/recordLabel
which language is spoken in khela;http://dbpedia.org/ontology/language
what is the name of a 2000 fantasy book;http://dbpedia.org/ontology/literaryGenre
where was andy montanez born;http://dbpedia.org/ontology/birthPlace
where is therobotateme from;http://dbpedia.org/ontology/hometown
what genre of music is the album satellite sky;http://dbpedia.org/ontology/genre
where was li kun born;http://dbpedia.org/ontology/birthPlace
