question;predicate
Where is the origin of tkatka;http://dbpedia.org/ontology/hometown
where did ruby keeler take his last breath;http://dbpedia.org/ontology/deathPlace
Who is a notable figure that was born in buenos aires;http://dbpedia.org/ontology/birthPlace
Which time zone is colona township located in;http://dbpedia.org/ontology/timeZone
which label did andy hill sign to an release music on;http://dbpedia.org/ontology/recordLabel
what genre of music does taro hakase produce;http://dbpedia.org/ontology/genre
What is the name of a soul music album;http://dbpedia.org/ontology/genre
What artist is in the rock music genre?;http://dbpedia.org/ontology/genre
what kind of film is hadrian;http://dbpedia.org/ontology/genre
Who is the artist signed onto columbia records;http://dbpedia.org/ontology/recordLabel
what city and state in the united states is tito francona from;http://dbpedia.org/ontology/birthPlace
What is a film that vladimir tarasov is known for?;http://dbpedia.org/ontology/director
what is the genre of the fantastic swordsmen;http://dbpedia.org/ontology/literaryGenre
What genre of music does monte montgomery create;http://dbpedia.org/ontology/genre
who directed the quick gun;http://dbpedia.org/ontology/director
what type of music does jimmy webb make;http://dbpedia.org/ontology/genre
what district is in the indian standard time;http://dbpedia.org/ontology/timeZone
Which genre is the artist thunder associated with;http://dbpedia.org/ontology/genre
what is the name of the place where john paul phelan was born;http://dbpedia.org/ontology/birthPlace
what is an alternative metal album;http://dbpedia.org/ontology/genre
Who is a baseball pitcher;http://dbpedia.org/ontology/position
who wrote the screenplay for die hard;http://dbpedia.org/ontology/writer
which musician was born in california;http://dbpedia.org/ontology/birthPlace
What's a town in the eastern daylight time;http://dbpedia.org/ontology/timeZone
which city did frank farrington decease in;http://dbpedia.org/ontology/deathPlace
what is a football position of andy white;http://dbpedia.org/ontology/position
which country is bill whelan from;http://dbpedia.org/ontology/birthPlace
Who's a critic born in cincinnati, ohio;http://dbpedia.org/ontology/birthPlace
what musical genre is  chromeo known for;http://dbpedia.org/ontology/genre
what types of book is in the night kitchen;http://dbpedia.org/ontology/literaryGenre
who is an artist that performs alternative rock;http://dbpedia.org/ontology/genre
Which position did stratos apostolakis play?;http://dbpedia.org/ontology/position
Where is divlje jagode from;http://dbpedia.org/ontology/hometown
which genre does chapel club belong to;http://dbpedia.org/ontology/genre
What style of music is the album i believe in everything?;http://dbpedia.org/ontology/genre
what musician is signed with delmark records;http://dbpedia.org/ontology/recordLabel
What is the name of an artist that creates alternative metal;http://dbpedia.org/ontology/genre
Where was christopher greenup born;http://dbpedia.org/ontology/birthPlace
what music genre is he touched me;http://dbpedia.org/ontology/genre
what is the tourist attraction at bahir dar?;http://dbpedia.org/ontology/location
Who wrote the song the quiet one;http://dbpedia.org/ontology/writer
what kind of music does bradley grace perform;http://dbpedia.org/ontology/genre
what category of music would execution guaranteed be under;http://dbpedia.org/ontology/genre
who was born in modena?;http://dbpedia.org/ontology/birthPlace
who is the author of the comforters;http://dbpedia.org/ontology/author
what netflix genre is fawlty towers under;http://dbpedia.org/ontology/genre
what artists perform country music;http://dbpedia.org/ontology/genre
What genre of music does jan jelinek play;http://dbpedia.org/ontology/genre
which actor was born in bonn?;http://dbpedia.org/ontology/birthPlace
What music genre is Ed Kuepper?;http://dbpedia.org/ontology/genre
what is a tv comedy version of the cartoon Scooby-Doo;http://dbpedia.org/ontology/genre
who are artists that record black metal music;http://dbpedia.org/ontology/genre
What type of music is on the album in the midst of beauty;http://dbpedia.org/ontology/genre
What is the name of an australian indie artist?;http://dbpedia.org/ontology/genre
in what position does cosmin olaroiu play;http://dbpedia.org/ontology/position
who was born in dortmund?;http://dbpedia.org/ontology/birthPlace
what genre of music does de phazz create;http://dbpedia.org/ontology/genre
what film did mario mattoli write/;http://dbpedia.org/ontology/writer
what kind of video game is vietcong 2;http://dbpedia.org/ontology/genre
where did james rachels die;http://dbpedia.org/ontology/deathPlace
What position does guyon fernandez play?;http://dbpedia.org/ontology/position
what sort of music is solaris;http://dbpedia.org/ontology/genre
what is allan trautman's place of birth;http://dbpedia.org/ontology/birthPlace
Where in the US was roger greenwald born;http://dbpedia.org/ontology/birthPlace
Which city in america was kelly clarkson born in;http://dbpedia.org/ontology/birthPlace
which politician was born in manchester?;http://dbpedia.org/ontology/birthPlace
what is the place of birth for louis de guiringaud;http://dbpedia.org/ontology/birthPlace
where was willem ruis born?;http://dbpedia.org/ontology/birthPlace
where was the place of birth of sydir kovpak;http://dbpedia.org/ontology/birthPlace
which position in football did larry kelley play in?;http://dbpedia.org/ontology/position
Who is an artist that is signed to the echo label;http://dbpedia.org/ontology/recordLabel
who directed the world of henry orient;http://dbpedia.org/ontology/director
What is the genre of music made by uff;http://dbpedia.org/ontology/genre
what book is fiction?;http://dbpedia.org/ontology/literaryGenre
in which city did hugo schmeisser die;http://dbpedia.org/ontology/deathPlace
what genre is the book the eagle and the wolves;http://dbpedia.org/ontology/literaryGenre
what type of music does gentleman reg perform;http://dbpedia.org/ontology/genre
what type of music does robin & linda williams  create;http://dbpedia.org/ontology/genre
Where was george percy badger's place of death?;http://dbpedia.org/ontology/deathPlace
what genre of music does the band army of anyone play?;http://dbpedia.org/ontology/genre
What is a book written by thomas merton;http://dbpedia.org/ontology/author
What's a book about nature;http://dbpedia.org/ontology/literaryGenre
what are some celtic music albums;http://dbpedia.org/ontology/genre
Which city was sam okoye in when he died;http://dbpedia.org/ontology/deathPlace
Who's a drummer that plays rock music;http://dbpedia.org/ontology/genre
what person was born in moscow;http://dbpedia.org/ontology/birthPlace
Whats the name of an acoustic music artist;http://dbpedia.org/ontology/genre
What is the time zone for the city of scandia?;http://dbpedia.org/ontology/timeZone
which city released 2 unlimited;http://dbpedia.org/ontology/hometown
What country is lawson robinson from?;http://dbpedia.org/ontology/birthPlace
where is jorgen beck's place of death?;http://dbpedia.org/ontology/deathPlace
where did  ayas mehmed pasha die;http://dbpedia.org/ontology/deathPlace
where is tanvir mokammel from;http://dbpedia.org/ontology/birthPlace
Which city and state was dennis johnson born in;http://dbpedia.org/ontology/birthPlace
whats the title of christian book;http://dbpedia.org/ontology/literaryGenre
whats an example of a progressive house album;http://dbpedia.org/ontology/genre
where was  jakub ficenec born;http://dbpedia.org/ontology/birthPlace
which central american country is elvis scott from;http://dbpedia.org/ontology/birthPlace
Name a song written by peter frampton.;http://dbpedia.org/ontology/writer
What type of genre does tripping the light fantastic perform?;http://dbpedia.org/ontology/genre
what type of music does ulrich schnauss create;http://dbpedia.org/ontology/genre
which genre of music does the lightyears play in?;http://dbpedia.org/ontology/genre
what is a work by ben moody;http://dbpedia.org/ontology/writer
what type of music is king of the kill;http://dbpedia.org/ontology/genre
Which musician was born in hamburg?;http://dbpedia.org/ontology/birthPlace
which county did marilyn chambers bite the dust in;http://dbpedia.org/ontology/deathPlace
what is the genre of andy west;http://dbpedia.org/ontology/genre
what artist is on the label highnote records;http://dbpedia.org/ontology/recordLabel
which genre of music does the code is red... long live the code belong to?;http://dbpedia.org/ontology/genre
what genre is imperativereaction;http://dbpedia.org/ontology/genre
Name a notable person who was born in buffalo, new york;http://dbpedia.org/ontology/birthPlace
Where is jonah matranga from;http://dbpedia.org/ontology/hometown
what genre is the tv show wolf;http://dbpedia.org/ontology/genre
what is the genre of the artist g. love & special sauce?;http://dbpedia.org/ontology/genre
what position does thembinkosi fanteni play;http://dbpedia.org/ontology/position
what is steve braun's nationality;http://dbpedia.org/ontology/birthPlace
What nationality is zhai yanpeng;http://dbpedia.org/ontology/birthPlace
what kind of music does dori caymmi make?;http://dbpedia.org/ontology/genre
what kind of music does tiana xiao perform;http://dbpedia.org/ontology/genre
whats an example of a biography book;http://dbpedia.org/ontology/literaryGenre
Where in German was torsten de winkel born?;http://dbpedia.org/ontology/birthPlace
What was the position of american football player garrison hearst?;http://dbpedia.org/ontology/position
Where was anders retzius born;http://dbpedia.org/ontology/birthPlace
what is saul riveras position in baseball;http://dbpedia.org/ontology/position
What is the name of a blues album;http://dbpedia.org/ontology/genre
Who was the producer for the film legally blonde?;http://dbpedia.org/ontology/producer
What kind of music does waka flocka flame mae;http://dbpedia.org/ontology/genre
Who was born in ypres?;http://dbpedia.org/ontology/birthPlace
what language is the film the yakuza in?;http://dbpedia.org/ontology/language
what kind of metal is the album staind;http://dbpedia.org/ontology/genre
what genre is wowowee associated with;http://dbpedia.org/ontology/genre
which football position did sailas namatak play?;http://dbpedia.org/ontology/position
what type of music is the album stone temple pilots;http://dbpedia.org/ontology/genre
Which film is directed by samira makhmalbaf;http://dbpedia.org/ontology/director
where did tetes raides originate from;http://dbpedia.org/ontology/hometown
what type of music does emina jahovic make?;http://dbpedia.org/ontology/genre
what is the dominant genre of is this it;http://dbpedia.org/ontology/genre
what language is heard in the taming of sunnybrook nell;http://dbpedia.org/ontology/language
what kind of music is e-tribe known for?;http://dbpedia.org/ontology/genre
what is the composition by bill berry?;http://dbpedia.org/ontology/writer
Name a card game;http://dbpedia.org/ontology/genre
which song did daryl hall write;http://dbpedia.org/ontology/writer
what position does marco ivan perez play?;http://dbpedia.org/ontology/position
What sort of music was recorded for breathless;http://dbpedia.org/ontology/genre
Where did alfred marshall die?;http://dbpedia.org/ontology/deathPlace
what type of music is elephant jokes;http://dbpedia.org/ontology/genre
who wrote the lyrics to let it go?;http://dbpedia.org/ontology/writer
what language was sleepwalking land originally written in?;http://dbpedia.org/ontology/language
Who wrote the film thunderbolt and lightfoot?;http://dbpedia.org/ontology/writer
what is the name of a science fiction book;http://dbpedia.org/ontology/literaryGenre
who was born in new york city;http://dbpedia.org/ontology/birthPlace
what position does eric dade play in football;http://dbpedia.org/ontology/position
What did julia donaldson write?;http://dbpedia.org/ontology/author
 omer vered is known for playing what soccer position;http://dbpedia.org/ontology/position
where in new york was howard wainer's birthplace?;http://dbpedia.org/ontology/birthPlace
What is tor marius gromstad's birth place;http://dbpedia.org/ontology/birthPlace
Where is seven stories located?;http://dbpedia.org/ontology/location
Who is the author from the book the worms of kukumlima;http://dbpedia.org/ontology/author
What baseball position is played by paul brown;http://dbpedia.org/ontology/position
who is the director of the guns and roses -- ik junoon movie;http://dbpedia.org/ontology/director
what is an action game?;http://dbpedia.org/ontology/genre
where is zoltan Agh born;http://dbpedia.org/ontology/birthPlace
Where was amir abdullah khan niazi's death?;http://dbpedia.org/ontology/deathPlace
What is an example of a crime fiction book;http://dbpedia.org/ontology/literaryGenre
who born in waubay and served in WWII and the korean war;http://dbpedia.org/ontology/birthPlace
Which city did gottlieb stephanie die in;http://dbpedia.org/ontology/deathPlace
alternative metal can be seen in what album?;http://dbpedia.org/ontology/genre
which type of music is associated with tess;http://dbpedia.org/ontology/genre
What type of musical style does mark mueller belong to?;http://dbpedia.org/ontology/genre
who was born in willemstad?;http://dbpedia.org/ontology/birthPlace
where did kurt hoffmann die?;http://dbpedia.org/ontology/deathPlace
what is located in millersburg;http://dbpedia.org/ontology/location
what music is db boulevard known for?;http://dbpedia.org/ontology/genre
What position does football player burakcan kunt play?;http://dbpedia.org/ontology/position
who directed mercy;http://dbpedia.org/ontology/director
what kind of music does joey moi play;http://dbpedia.org/ontology/genre
Where did keshavram kashiram shastri die;http://dbpedia.org/ontology/deathPlace
What genre of music does cold war kids make?;http://dbpedia.org/ontology/genre
Who was born in aldershot?;http://dbpedia.org/ontology/birthPlace
what is a rock music album?;http://dbpedia.org/ontology/genre
What position does kevin welsh play;http://dbpedia.org/ontology/position
who is someone that was born in sao paulo;http://dbpedia.org/ontology/birthPlace
Which genre of music is on the album solo para fanaticos;http://dbpedia.org/ontology/genre
what is the genre of live at the meadowlands;http://dbpedia.org/ontology/genre
who was the director for the wild things;http://dbpedia.org/ontology/director
who directed the film nightwing?;http://dbpedia.org/ontology/director
What type of music is bruce watson known for creating;http://dbpedia.org/ontology/genre
What is the genre of music martin belmont makes?;http://dbpedia.org/ontology/genre
Which actress was born in london?;http://dbpedia.org/ontology/birthPlace
what album has alternative rock;http://dbpedia.org/ontology/genre
Name a folk music album;http://dbpedia.org/ontology/genre
Who's a senator born in manchester;http://dbpedia.org/ontology/birthPlace
what is one of robert caro's works;http://dbpedia.org/ontology/author
what position does american football player matt bowen play;http://dbpedia.org/ontology/position
which position does piyachart tamaphan play;http://dbpedia.org/ontology/position
what album is a type of americana (music)?;http://dbpedia.org/ontology/genre
what is the label that herb pedersen is under?;http://dbpedia.org/ontology/recordLabel
Who was the executive producer of casino royale;http://dbpedia.org/ontology/producer
who was born in tahiti;http://dbpedia.org/ontology/birthPlace
what song was written by harry nilsson;http://dbpedia.org/ontology/writer
where in the world did jesse owens take his last breath;http://dbpedia.org/ontology/deathPlace
which baseball position does sonny hoffman play;http://dbpedia.org/ontology/position
what kind of music is on screaming blue murder: dedicated to phil lynott?;http://dbpedia.org/ontology/genre
what is the genre of the computer videogame tekken 2;http://dbpedia.org/ontology/genre
What is the nationality of ty warner;http://dbpedia.org/ontology/birthPlace
what city was mario haasborn;http://dbpedia.org/ontology/birthPlace
What's a soul music album featuring estelle;http://dbpedia.org/ontology/genre
what position is lorenzo faravelli charged of;http://dbpedia.org/ontology/position
where did eiffel 65 come from?;http://dbpedia.org/ontology/hometown
Which city in europe was gabriel-hippolyte destailleur born in;http://dbpedia.org/ontology/birthPlace
what position does football player peter moller play at?;http://dbpedia.org/ontology/position
Where did robert f. mcdermott end his life?;http://dbpedia.org/ontology/deathPlace
what's a historic site in flat rock;http://dbpedia.org/ontology/location
who was the lyricist of the composition waterloo sunset?;http://dbpedia.org/ontology/writer
who is a basketball player whose position is  shooting guard;http://dbpedia.org/ontology/position
Who was born at the bronx?;http://dbpedia.org/ontology/birthPlace
What is heinrich fraenkel's nationality;http://dbpedia.org/ontology/birthPlace
What sort of music does herbie hancock perform;http://dbpedia.org/ontology/genre
What is a county that can be found in the utc-5 time zone?;http://dbpedia.org/ontology/timeZone
what types of tv program is pretty guardian sailormoon;http://dbpedia.org/ontology/genre
Name a person born in new york city;http://dbpedia.org/ontology/birthPlace
Which genre of music does ekho record?;http://dbpedia.org/ontology/genre
which country is chantal daucourt from;http://dbpedia.org/ontology/birthPlace
is the way i am soul music is dance music;http://dbpedia.org/ontology/genre
who directed dragon squad?;http://dbpedia.org/ontology/director
which famous bodyguard was born in chicago;http://dbpedia.org/ontology/birthPlace
how can dealing with dragons be classified by genre;http://dbpedia.org/ontology/literaryGenre
Ingmar bergman directed what film?;http://dbpedia.org/ontology/director
richard shaw brown performs what type of music?;http://dbpedia.org/ontology/genre
What's a city that uses eastern european time;http://dbpedia.org/ontology/timeZone
who is a  metalcore  artist;http://dbpedia.org/ontology/genre
what album plays gothic metal music?;http://dbpedia.org/ontology/genre
What country is phil quinlan from;http://dbpedia.org/ontology/birthPlace
Who was born in famagusta?;http://dbpedia.org/ontology/birthPlace
who composed radio nowhere;http://dbpedia.org/ontology/writer
which genre of music does vanity beach play;http://dbpedia.org/ontology/genre
under which label does emma hewitt work;http://dbpedia.org/ontology/recordLabel
Name a person born in Fernie, British Columbia.;http://dbpedia.org/ontology/birthPlace
What genre is wizards of waverly place;http://dbpedia.org/ontology/genre
what type of music does tin star orphans make;http://dbpedia.org/ontology/genre
who directed special bulletin;http://dbpedia.org/ontology/director
Who is the author of the novel of mice and men?;http://dbpedia.org/ontology/author
Name a reggae musician.;http://dbpedia.org/ontology/genre
what genre is dave clark (canadian musician);http://dbpedia.org/ontology/genre
who was born in crestline?;http://dbpedia.org/ontology/birthPlace
what kind of music does jean-michel pilc make;http://dbpedia.org/ontology/genre
Who is an artist on warner bros. records label?;http://dbpedia.org/ontology/recordLabel
what city was john roche born in?;http://dbpedia.org/ontology/birthPlace
Which city did bill hinchman die in;http://dbpedia.org/ontology/deathPlace
What sort of movie is atomic train;http://dbpedia.org/ontology/genre
What record label is red simpson associated with;http://dbpedia.org/ontology/recordLabel
what is the genre of jonny quest;http://dbpedia.org/ontology/genre
Name someone from new haven;http://dbpedia.org/ontology/birthPlace
where in japan is hiroki wada originally from;http://dbpedia.org/ontology/hometown
what genre does exit project create;http://dbpedia.org/ontology/genre
Who directed the film schindler's list;http://dbpedia.org/ontology/director
which city in ireland was sean finn born;http://dbpedia.org/ontology/birthPlace
What is the name of a industrial music album?;http://dbpedia.org/ontology/genre
What position does kit mueller play;http://dbpedia.org/ontology/position
where was albert lee born;http://dbpedia.org/ontology/birthPlace
which state was aedin mincks born in;http://dbpedia.org/ontology/birthPlace
who created the story of the movie avana ivan;http://dbpedia.org/ontology/writer
where in southern california was kirk fox born;http://dbpedia.org/ontology/birthPlace
where in canada did poledo originate from?;http://dbpedia.org/ontology/hometown
who directed life during wartime;http://dbpedia.org/ontology/director
Where was giovanni pascoli deceased?;http://dbpedia.org/ontology/deathPlace
What kind of music does jessy dixon record?;http://dbpedia.org/ontology/genre
who is new york city the birth place of;http://dbpedia.org/ontology/birthPlace
in what language is embers film spoken;http://dbpedia.org/ontology/language
What is the origin of the artist Mastilo?;http://dbpedia.org/ontology/hometown
Name someone who was born in jakarta;http://dbpedia.org/ontology/birthPlace
Where is vbirds originally from;http://dbpedia.org/ontology/hometown
what does lucas digne do in soccer;http://dbpedia.org/ontology/position
What kind of music is en la madrugada se fue;http://dbpedia.org/ontology/genre
what city and state was daniel hernandez born;http://dbpedia.org/ontology/birthPlace
what kind of music can be found on the album called nothing to lose;http://dbpedia.org/ontology/genre
what music is stand?;http://dbpedia.org/ontology/genre
what is the genre of the artist cryoftheafflicted;http://dbpedia.org/ontology/genre
which french actress was born in manosque;http://dbpedia.org/ontology/birthPlace
what anime could be considered like an action film;http://dbpedia.org/ontology/genre
Who was born in the european city of freudenstadt?;http://dbpedia.org/ontology/birthPlace
who was born in texas;http://dbpedia.org/ontology/birthPlace
what film did joe roth produce?;http://dbpedia.org/ontology/producer
Which timezone is glencoe located in;http://dbpedia.org/ontology/timeZone
what position does fabio giordano play;http://dbpedia.org/ontology/position
what is the genre of the album dose;http://dbpedia.org/ontology/genre
What time zone is used in pelham;http://dbpedia.org/ontology/timeZone
what kind of music does chapman whitney streetwalkers play;http://dbpedia.org/ontology/genre
what episode was directed by laura innes?;http://dbpedia.org/ontology/director
what type of music is king of the blues;http://dbpedia.org/ontology/genre
what type of music does my life with the thrill kill kult make?;http://dbpedia.org/ontology/genre
Name a person named in the united states.;http://dbpedia.org/ontology/birthPlace
what films have been produced under sidney kimmel?;http://dbpedia.org/ontology/producer
Which city broadcasts kvea radio;http://dbpedia.org/ontology/location
Where did ernst podder die;http://dbpedia.org/ontology/deathPlace
what is a japanese rock music album;http://dbpedia.org/ontology/genre
What was the place of death of frank chance;http://dbpedia.org/ontology/deathPlace
Who is the author of the book city of djinns;http://dbpedia.org/ontology/author
what book is written by fawn m. brodie?;http://dbpedia.org/ontology/author
what type of music does zuri west play;http://dbpedia.org/ontology/genre
Who is a heavy metal artist;http://dbpedia.org/ontology/genre
what kind of music does side walk slam make?;http://dbpedia.org/ontology/genre
what is a tourist attraction in 1770, queensland;http://dbpedia.org/ontology/location
which language is used in the iron claw;http://dbpedia.org/ontology/language
who composed it's a new day;http://dbpedia.org/ontology/writer
where was jean-louis debre born;http://dbpedia.org/ontology/birthPlace
what kinds of music is joe's menage;http://dbpedia.org/ontology/genre
what position does damaso espino play in baseball;http://dbpedia.org/ontology/position
what kind of video game is carmen sandiego: the secret of the stolen drums;http://dbpedia.org/ontology/genre
What is a known song that steve vai has written;http://dbpedia.org/ontology/writer
what artist plays blues-rock music?;http://dbpedia.org/ontology/genre
What genre of music is the album domestica?;http://dbpedia.org/ontology/genre
what are alternative metal artists;http://dbpedia.org/ontology/genre
which musician is considered a cabaret artist;http://dbpedia.org/ontology/genre
Who was the producer on flying swords of dragon gate;http://dbpedia.org/ontology/producer
What genre is paddy keenan?;http://dbpedia.org/ontology/genre
What is the name of a country artist;http://dbpedia.org/ontology/genre
what record is produced by ronnie mcdowell;http://dbpedia.org/ontology/recordLabel
what's a death metal band;http://dbpedia.org/ontology/genre
what type of music does boom boom satellites play;http://dbpedia.org/ontology/genre
What professor was born in brooklyn?;http://dbpedia.org/ontology/birthPlace
What position does bjorn anklev play?;http://dbpedia.org/ontology/position
which european nation does nembrionic belong to?;http://dbpedia.org/ontology/hometown
Where is ernesto mejia from?;http://dbpedia.org/ontology/birthPlace
Name a person born in budapest.;http://dbpedia.org/ontology/birthPlace
which country is john raphael from;http://dbpedia.org/ontology/birthPlace
what argentinian place did luis perlotti die;http://dbpedia.org/ontology/deathPlace
Who was born in the city of katsina?;http://dbpedia.org/ontology/birthPlace
which subset of rock and roll best describes tailor made (album);http://dbpedia.org/ontology/genre
what genre of music does erik wroldsen like?;http://dbpedia.org/ontology/genre
Name a person born in alytus.;http://dbpedia.org/ontology/birthPlace
what country did christine noonan pass away in;http://dbpedia.org/ontology/deathPlace
which electronica album was produced by the band sparks?;http://dbpedia.org/ontology/genre
