question;predicate
where in the united states did john kennedy toole die?;http://dbpedia.org/ontology/deathPlace
who wrote la reine margot;http://dbpedia.org/ontology/author
Who's the author of o shepherd, speak!;http://dbpedia.org/ontology/author
what is a song by Jay-Z is featured by rihanna;http://dbpedia.org/ontology/writer
which position does luke clark play;http://dbpedia.org/ontology/position
who was a person born in ealing;http://dbpedia.org/ontology/birthPlace
where was the birth place of byron smith;http://dbpedia.org/ontology/birthPlace
Where in pennsylvania was harry o'neill born;http://dbpedia.org/ontology/birthPlace
What position does harizul izuan abdul rani play?;http://dbpedia.org/ontology/position
Which language is in the film dr. jekyll and mr. hyde;http://dbpedia.org/ontology/language
Which genre of music does the legendary pink dots make;http://dbpedia.org/ontology/genre
what time zone is monsteras in?;http://dbpedia.org/ontology/timeZone
Where was robert vallee born;http://dbpedia.org/ontology/birthPlace
What is a film written by thom fitzgerald?;http://dbpedia.org/ontology/writer
Where in Scotland was flora stevenson born?;http://dbpedia.org/ontology/birthPlace
what type of videogame is gregory horror show;http://dbpedia.org/ontology/genre
which baseball pitcher was born in pittsburgh;http://dbpedia.org/ontology/birthPlace
what kind of tv show was a pup named scooby-doo;http://dbpedia.org/ontology/genre
who was born in bolivia?;http://dbpedia.org/ontology/birthPlace
what position does  kevin mench play;http://dbpedia.org/ontology/position
which castle is located in wallingford, oxfordshire;http://dbpedia.org/ontology/location
what type of game is forsaken?;http://dbpedia.org/ontology/genre
Where in Canada is stephen mchattie born?;http://dbpedia.org/ontology/birthPlace
which film is joie lee a story contributor for;http://dbpedia.org/ontology/writer
which time zone is gura humorului in;http://dbpedia.org/ontology/timeZone
which record is created by peter watts;http://dbpedia.org/ontology/recordLabel
what country was jerome thomas born in?;http://dbpedia.org/ontology/birthPlace
Where is ernst dohm from;http://dbpedia.org/ontology/birthPlace
where was simon church born?;http://dbpedia.org/ontology/birthPlace
what genre is the game virtual pool 3?;http://dbpedia.org/ontology/genre
who was born in wincanton?;http://dbpedia.org/ontology/birthPlace
what city did herbert weichmanndie;http://dbpedia.org/ontology/deathPlace
what is the birth place of mehdi belhaj kacem;http://dbpedia.org/ontology/birthPlace
who was born in russia?;http://dbpedia.org/ontology/birthPlace
what is a town in the eastern daylight time?;http://dbpedia.org/ontology/timeZone
who is the producer of the the sun also rises film;http://dbpedia.org/ontology/producer
what is a suspense book written by agatha christie;http://dbpedia.org/ontology/literaryGenre
what position does bob heise play;http://dbpedia.org/ontology/position
what genre is the book syrup;http://dbpedia.org/ontology/literaryGenre
where is the ralph johnson bunche house located;http://dbpedia.org/ontology/location
What musical genre is cut copy;http://dbpedia.org/ontology/genre
Where was eric owens born?;http://dbpedia.org/ontology/birthPlace
what kind of music is on alpha noir / omega white?;http://dbpedia.org/ontology/genre
what type of pop album is pink lady twin best;http://dbpedia.org/ontology/genre
What type of music is played on eye of the hurricane;http://dbpedia.org/ontology/genre
where in france did roland fraisse die in?;http://dbpedia.org/ontology/deathPlace
What genre of music are the citizens;http://dbpedia.org/ontology/genre
what genre does kid 606 perform in;http://dbpedia.org/ontology/genre
which country is mauricio pinilla from;http://dbpedia.org/ontology/birthPlace
Where is sylvanus n. staples house located?;http://dbpedia.org/ontology/location
Name an action game.;http://dbpedia.org/ontology/genre
what type of rock is the album yankee hotel foxtrot;http://dbpedia.org/ontology/genre
what position is zeke wrigley known for;http://dbpedia.org/ontology/position
where was sallai meridor born?;http://dbpedia.org/ontology/birthPlace
which record label is z-ro signed with?;http://dbpedia.org/ontology/recordLabel
where was andres thomas born;http://dbpedia.org/ontology/birthPlace
what kind of music can be found by listening to the album just chillin';http://dbpedia.org/ontology/genre
what is the genre of the artist alexi murdoch;http://dbpedia.org/ontology/genre
what kind of film is addition and subtraction?;http://dbpedia.org/ontology/language
Who directed the french film le golem?;http://dbpedia.org/ontology/director
gattman is in which time zone;http://dbpedia.org/ontology/timeZone
what label worked with ed askew;http://dbpedia.org/ontology/recordLabel
What position does bernd holzenbein play?;http://dbpedia.org/ontology/position
who is the record label of the artist thelonious monk?;http://dbpedia.org/ontology/recordLabel
what country is stefan richarz from;http://dbpedia.org/ontology/birthPlace
where was morgan d. peoples given birth;http://dbpedia.org/ontology/birthPlace
what kind of music is on the album allure;http://dbpedia.org/ontology/genre
of which nationality is mario de alencar;http://dbpedia.org/ontology/birthPlace
Where was alexander mitchell born?;http://dbpedia.org/ontology/birthPlace
what is hollis mclaren's birth place;http://dbpedia.org/ontology/birthPlace
what was originated by teremoana rapley;http://dbpedia.org/ontology/hometown
which country did sir anthony jackson pass away in;http://dbpedia.org/ontology/deathPlace
what album falls under the category of folk music;http://dbpedia.org/ontology/genre
What type of fiction book is the tombs of atuan;http://dbpedia.org/ontology/literaryGenre
where did petar parchevich die;http://dbpedia.org/ontology/deathPlace
where was kai hansen born in?;http://dbpedia.org/ontology/birthPlace
what kind of video game is brutal legend?;http://dbpedia.org/ontology/genre
which album is produced by the martinis;http://dbpedia.org/ontology/recordLabel
what artist is under the record label  metal blade records;http://dbpedia.org/ontology/recordLabel
what genre is the album have a nice day;http://dbpedia.org/ontology/genre
who wrote something called the problem of the covered bridge;http://dbpedia.org/ontology/author
What's an episode of south park directed by trey parker;http://dbpedia.org/ontology/director
where did cathy downs pass away in;http://dbpedia.org/ontology/deathPlace
what type of music is suspicious activity?;http://dbpedia.org/ontology/genre
what position does lee goodwin play in soccer;http://dbpedia.org/ontology/position
what position does corky withrow play;http://dbpedia.org/ontology/position
what artist makes pop music music?;http://dbpedia.org/ontology/genre
What genre does psilodump fall under?;http://dbpedia.org/ontology/genre
What music genre would Lucas Silvereia fall into?;http://dbpedia.org/ontology/genre
What is mark difelice position;http://dbpedia.org/ontology/position
what time zone is hartford in;http://dbpedia.org/ontology/timeZone
what Italian hammer is from palmanova;http://dbpedia.org/ontology/birthPlace
what city in Germany was hilmar zahn born;http://dbpedia.org/ontology/birthPlace
what is an example of a punk rock artist?;http://dbpedia.org/ontology/genre
What type of music does model a make;http://dbpedia.org/ontology/genre
what is the genre of the album in trance;http://dbpedia.org/ontology/genre
where was asmus jacob carstens born;http://dbpedia.org/ontology/deathPlace
what's the name of a progressive rock band;http://dbpedia.org/ontology/genre
Who's the writer of the man with the golden gun;http://dbpedia.org/ontology/writer
what book genre is survivors quest?;http://dbpedia.org/ontology/literaryGenre
what type of music is on phoenix?;http://dbpedia.org/ontology/genre
What genre of music does tadpole create;http://dbpedia.org/ontology/genre
what films have francis ford coppola produced?;http://dbpedia.org/ontology/producer
where was amelia curtis given birth;http://dbpedia.org/ontology/birthPlace
who was the director of la terrazza;http://dbpedia.org/ontology/director
who was born in arlington county?;http://dbpedia.org/ontology/birthPlace
in what puerto rican town was carlos delgado born;http://dbpedia.org/ontology/birthPlace
what game is a platform game?;http://dbpedia.org/ontology/genre
what is johnny dee's record label;http://dbpedia.org/ontology/recordLabel
What is a composition by barry manilow?;http://dbpedia.org/ontology/writer
what is the location of eastern daylight time?;http://dbpedia.org/ontology/timeZone
what type of music does vektor make;http://dbpedia.org/ontology/genre
what is an album with experimental rock music?;http://dbpedia.org/ontology/genre
what is a film in the anime genre;http://dbpedia.org/ontology/language
Which position did former football player mike mandarino play?;http://dbpedia.org/ontology/position
which recording label signed bilinda butcher;http://dbpedia.org/ontology/recordLabel
state len stephenson's football position;http://dbpedia.org/ontology/position
what time zone is lindstrom in;http://dbpedia.org/ontology/timeZone
Where was eilaine roth born?;http://dbpedia.org/ontology/birthPlace
What lyrics did John Oates write?;http://dbpedia.org/ontology/writer
What subgenre of rock does scott matthew play;http://dbpedia.org/ontology/genre
What genre is the album democracy?;http://dbpedia.org/ontology/genre
what is a 1995 science fiction book;http://dbpedia.org/ontology/literaryGenre
where did kim nam-il originate from;http://dbpedia.org/ontology/birthPlace
what position does jules rykovich play in football;http://dbpedia.org/ontology/position
jon card could be labeled as what;http://dbpedia.org/ontology/genre
What position does christophe mandanne play?;http://dbpedia.org/ontology/position
which time zone is wrightstown in;http://dbpedia.org/ontology/timeZone
What is the birth place of palmiro togliatti;http://dbpedia.org/ontology/birthPlace
Where in the United States is south pointe park?;http://dbpedia.org/ontology/location
what law and order episode did blake masters write;http://dbpedia.org/ontology/writer
what person plays the baseball position of a pitcher?;http://dbpedia.org/ontology/position
Which time zone is plainville located in;http://dbpedia.org/ontology/timeZone
what types of music is three ringz;http://dbpedia.org/ontology/genre
what time zone encompasses south woodbridge;http://dbpedia.org/ontology/timeZone
Name an Australian academic born in melbourne;http://dbpedia.org/ontology/birthPlace
Which Ivy league alumni is signed with reprise records?;http://dbpedia.org/ontology/recordLabel
What nation is al helfer from;http://dbpedia.org/ontology/birthPlace
Who directed the film the man who cried;http://dbpedia.org/ontology/director
What is an example of a mystery novel?;http://dbpedia.org/ontology/literaryGenre
where did bobb trimble originate from;http://dbpedia.org/ontology/hometown
where was childe hassam born;http://dbpedia.org/ontology/birthPlace
what position does federico elduayen play in soccer;http://dbpedia.org/ontology/position
Where was gedeon raday born?;http://dbpedia.org/ontology/birthPlace
what kind of music is silence is sexy;http://dbpedia.org/ontology/genre
which film was vinicius de moraes a story contributor for?;http://dbpedia.org/ontology/writer
what position does takashi amano play;http://dbpedia.org/ontology/position
Name an artist within the grindcore genre?;http://dbpedia.org/ontology/genre
Which time zone is fredonia in?;http://dbpedia.org/ontology/timeZone
Who produced the movie cop;http://dbpedia.org/ontology/producer
What label is the paper chase (band) signed to?;http://dbpedia.org/ontology/recordLabel
who is the executive producer of national treasure?;http://dbpedia.org/ontology/producer
which country is anna proclemer from;http://dbpedia.org/ontology/birthPlace
what genre was the elves of cintra written in;http://dbpedia.org/ontology/literaryGenre
What city did the september when come from?;http://dbpedia.org/ontology/hometown
what language does zong pu speak;http://dbpedia.org/ontology/language
What is an album that features dubstep?;http://dbpedia.org/ontology/genre
What genre of book is new moon (novel)?;http://dbpedia.org/ontology/literaryGenre
What former footballer was born in birmingham?;http://dbpedia.org/ontology/birthPlace
where was maria bello born;http://dbpedia.org/ontology/birthPlace
what city in france was antoine laurent de jussieu  born;http://dbpedia.org/ontology/birthPlace
what european nation does wieslaw chrzanowski belong to?;http://dbpedia.org/ontology/birthPlace
what kind of music does pixie lott produce;http://dbpedia.org/ontology/genre
which label signed jennifer warnes;http://dbpedia.org/ontology/recordLabel
What is pablo andres gonzalez's nationality?;http://dbpedia.org/ontology/birthPlace
what nationality is brian boyle;http://dbpedia.org/ontology/birthPlace
Where is lake okareka located;http://dbpedia.org/ontology/location
What is one artist who has recorded under polydor records?;http://dbpedia.org/ontology/recordLabel
what is a township that is located in north american central time zone;http://dbpedia.org/ontology/timeZone
What has marguerite henry written;http://dbpedia.org/ontology/author
Where was roel van duijn born;http://dbpedia.org/ontology/birthPlace
Name an artist that performs doom metal  music;http://dbpedia.org/ontology/genre
what kind of music is niclas engelin associated with;http://dbpedia.org/ontology/genre
What is a game that is categorized as a shooter game;http://dbpedia.org/ontology/genre
who was the director for the day after tomorrow;http://dbpedia.org/ontology/director
what european city did dorian shainin die;http://dbpedia.org/ontology/deathPlace
which kind of music is chrishawkesmusic known for?;http://dbpedia.org/ontology/genre
what type of music does etta jones make;http://dbpedia.org/ontology/genre
what movie did carlos reygadas produce;http://dbpedia.org/ontology/producer
What is an example of a composition by jule styne;http://dbpedia.org/ontology/writer
is the album hallelujah time! jazz or hip-hop;http://dbpedia.org/ontology/genre
Who directed the film tweet and lovely;http://dbpedia.org/ontology/director
What position does helmut hermann play in soccer;http://dbpedia.org/ontology/position
What type of music does keith richards play?;http://dbpedia.org/ontology/genre
Who is a second baseman;http://dbpedia.org/ontology/position
Name someone born in petaluma, california;http://dbpedia.org/ontology/birthPlace
what type of music does jeff sherman play;http://dbpedia.org/ontology/genre
what television genre is the program  luna mystika;http://dbpedia.org/ontology/genre
who is a flamenco artist;http://dbpedia.org/ontology/genre
Name a book that author gary gygax has written;http://dbpedia.org/ontology/author
what building is found in foxborough?;http://dbpedia.org/ontology/location
what song did chris frantz write;http://dbpedia.org/ontology/writer
What is an example of a rock album?;http://dbpedia.org/ontology/genre
what is a fiction book based around StarTrek;http://dbpedia.org/ontology/literaryGenre
What type of album is in the eye of the storm?;http://dbpedia.org/ontology/genre
what baseball position does jose escobar play;http://dbpedia.org/ontology/position
where did ferdinand de la cerda's life end;http://dbpedia.org/ontology/deathPlace
which asian country is kujtim Cashku from;http://dbpedia.org/ontology/birthPlace
who was born in uvalde?;http://dbpedia.org/ontology/birthPlace
where was the death place of bhadriraju krishnamurti;http://dbpedia.org/ontology/deathPlace
which record label signed the serenes;http://dbpedia.org/ontology/recordLabel
what book is from the speculative fiction genre?;http://dbpedia.org/ontology/literaryGenre
Where in Australia did george simpson die?;http://dbpedia.org/ontology/deathPlace
Which position in professional hockey does dainius zubrus play;http://dbpedia.org/ontology/position
Name a sword and sorcery book;http://dbpedia.org/ontology/literaryGenre
what cities are in the central european time zone;http://dbpedia.org/ontology/timeZone
which city did francis warrington gillet die;http://dbpedia.org/ontology/deathPlace
Who is an artist that is signed to philips records;http://dbpedia.org/ontology/recordLabel
Who's signed to dischord records;http://dbpedia.org/ontology/recordLabel
who directed the film greedy for tweety;http://dbpedia.org/ontology/director
what type of music is on this time around?;http://dbpedia.org/ontology/genre
what genre does patrick moraz classify under;http://dbpedia.org/ontology/genre
what type of book is the the darkest evening of the year;http://dbpedia.org/ontology/literaryGenre
what kind of music is play nice;http://dbpedia.org/ontology/genre
What is a composition that was created by van morrison?;http://dbpedia.org/ontology/writer
what position does red kelly play;http://dbpedia.org/ontology/position
what football position does iuliu baratky play?;http://dbpedia.org/ontology/position
what is a fantasy book?;http://dbpedia.org/ontology/literaryGenre
what position does damir kreilach play in football;http://dbpedia.org/ontology/position
what is the place of birth of arthur malkin;http://dbpedia.org/ontology/birthPlace
what films did derrick borte write;http://dbpedia.org/ontology/writer
Where was hartmann lauterbacher born;http://dbpedia.org/ontology/birthPlace
which song did andrew william harvey taylor write the words for;http://dbpedia.org/ontology/writer
what is an alternative rock album;http://dbpedia.org/ontology/genre
which position did mark trumbo play;http://dbpedia.org/ontology/position
Who wrote the book american buffalo;http://dbpedia.org/ontology/author
Where was giovanni battista giraldi born;http://dbpedia.org/ontology/birthPlace
what is the nationality of oleksandr radchenko;http://dbpedia.org/ontology/birthPlace
what did guillermo franco die?;http://dbpedia.org/ontology/deathPlace
what genre is tour 2003?;http://dbpedia.org/ontology/genre
which position in football does james develin play;http://dbpedia.org/ontology/position
what kind of album does sulk belong to?;http://dbpedia.org/ontology/genre
What book is focused on sociology;http://dbpedia.org/ontology/literaryGenre
what game is part of the platform game genre;http://dbpedia.org/ontology/genre
where did bill monroe kick the bucket;http://dbpedia.org/ontology/deathPlace
Who produced the movie dr. horribles sing-along blog;http://dbpedia.org/ontology/producer
Who directed the film the fighting renegade;http://dbpedia.org/ontology/director
Where was derick etwaroo born?;http://dbpedia.org/ontology/birthPlace
what sort of music album is group therapy;http://dbpedia.org/ontology/genre
what position did jacob erskine play in soccer?;http://dbpedia.org/ontology/position
which football position is hassoun camara charged of;http://dbpedia.org/ontology/position
who directed amour;http://dbpedia.org/ontology/director
frankmusik is what music genre;http://dbpedia.org/ontology/genre
where was barun de born;http://dbpedia.org/ontology/birthPlace
which football player was born in aurora?;http://dbpedia.org/ontology/birthPlace
which country is hugo brizuela from;http://dbpedia.org/ontology/birthPlace
What country is steven morris from;http://dbpedia.org/ontology/birthPlace
what city was joe genewich born in;http://dbpedia.org/ontology/birthPlace
what album is country;http://dbpedia.org/ontology/genre
what is an alternative rock artist?;http://dbpedia.org/ontology/genre
Where is Patrick Cowley from?;http://dbpedia.org/ontology/hometown
what country gives nationality to barbara a. schaal;http://dbpedia.org/ontology/birthPlace
which city is the book tower found in;http://dbpedia.org/ontology/location
what time zone is reno township a part of;http://dbpedia.org/ontology/timeZone
what film did olivier assayas direct;http://dbpedia.org/ontology/director
Where in canada was george tustin born;http://dbpedia.org/ontology/birthPlace
What's a defensive position that jonathan nelson can play;http://dbpedia.org/ontology/position
which record label is aghora signed to;http://dbpedia.org/ontology/recordLabel
what musical genre is city nights;http://dbpedia.org/ontology/genre
which city and state is troy in?;http://dbpedia.org/ontology/location
what movie is written by hal roach?;http://dbpedia.org/ontology/writer
where did chvrches come from?;http://dbpedia.org/ontology/hometown
what is one of avicii's compositions;http://dbpedia.org/ontology/writer
Where in the united states is jones motor company;http://dbpedia.org/ontology/location
tomas bagi was born in which city in Slovakia?;http://dbpedia.org/ontology/birthPlace
what is the title of a movie that is a  bollywood film;http://dbpedia.org/ontology/language
where is peter evrard originally from;http://dbpedia.org/ontology/hometown
what country is cynthia mckinney a citizen of;http://dbpedia.org/ontology/birthPlace
whats the name of a coffee table book;http://dbpedia.org/ontology/literaryGenre
What works have been written by chris pierson;http://dbpedia.org/ontology/author
what label manages the artist evangeline;http://dbpedia.org/ontology/recordLabel
who wrote two mules for sister sara?;http://dbpedia.org/ontology/writer
Name a professional soccer player born in maidstone;http://dbpedia.org/ontology/birthPlace
what type of music does pelle carlberg play?;http://dbpedia.org/ontology/genre
where was regina george born;http://dbpedia.org/ontology/birthPlace
What is the name of a new wave music band;http://dbpedia.org/ontology/genre
what type of book is the name of the rose?;http://dbpedia.org/ontology/literaryGenre
what genre does katie reider perform in;http://dbpedia.org/ontology/genre
what kind of music is on native tongue (album)?;http://dbpedia.org/ontology/genre
what language is spoken in cadavre exquis premiere edition?;http://dbpedia.org/ontology/language
which town did jeremiah clemens die;http://dbpedia.org/ontology/deathPlace
which language is spoken in symphony;http://dbpedia.org/ontology/language
what italian commune is in the central european time zone;http://dbpedia.org/ontology/timeZone
What language was escape from memory originally written in;http://dbpedia.org/ontology/language
What's a city in oregon that uses the pacific time zone;http://dbpedia.org/ontology/timeZone
what nationality is david rozgonyi;http://dbpedia.org/ontology/birthPlace
where is beranger aymard bosse from;http://dbpedia.org/ontology/birthPlace
What is a film that johann wolfgang von goethe contributed film story to;http://dbpedia.org/ontology/writer
What is the place of death of levi lincoln, jr.;http://dbpedia.org/ontology/deathPlace
What is the name of the dance music genre album?;http://dbpedia.org/ontology/genre
what is an adventure video game;http://dbpedia.org/ontology/genre
What genre of music does dave douglas (trumpeter) play;http://dbpedia.org/ontology/genre
where was arjan beqaj's place of birth;http://dbpedia.org/ontology/birthPlace
Where did Walter Chyzowych die?;http://dbpedia.org/ontology/deathPlace
what is one of howard devoto's pieces;http://dbpedia.org/ontology/writer
Name an album from the pop rock genre;http://dbpedia.org/ontology/genre
What is the name of a fantasy tv show based in britain?;http://dbpedia.org/ontology/genre
what is the genre of the artist joey cape;http://dbpedia.org/ontology/genre
what's a power metal act that's signed to massacre records;http://dbpedia.org/ontology/recordLabel
what is the place of death associated with john mclean;http://dbpedia.org/ontology/deathPlace
Which album is a latin pop album>;http://dbpedia.org/ontology/genre
what position does sebastian langkamp play;http://dbpedia.org/ontology/position
who wrote the story for the film patton (film)?;http://dbpedia.org/ontology/writer
Where was nadia gamel born;http://dbpedia.org/ontology/birthPlace
what football position did damien gregorini play;http://dbpedia.org/ontology/position
what lyrics did charles brown (musician) write;http://dbpedia.org/ontology/writer
What is the cvg genre of jeremy mcgrath supercross world;http://dbpedia.org/ontology/genre
which stereo mc producer was born in nottingham?;http://dbpedia.org/ontology/birthPlace
where in india was laxminarayan pandey born;http://dbpedia.org/ontology/birthPlace
what is a kind of science fiction book?;http://dbpedia.org/ontology/literaryGenre
what position does khurshed makhmudov play;http://dbpedia.org/ontology/position
Which genre of music is made by pedro fernandez;http://dbpedia.org/ontology/genre
what position does football player krzysztof maczynski play;http://dbpedia.org/ontology/position
adolf hedin died in which Swedish city?;http://dbpedia.org/ontology/deathPlace
from which country is morgenstern from;http://dbpedia.org/ontology/hometown
Name an artist who produces rock music;http://dbpedia.org/ontology/genre
what language is on the film ssukh;http://dbpedia.org/ontology/language
What label is joaquin cardiel signed to;http://dbpedia.org/ontology/recordLabel
what type of music is god is greater than man;http://dbpedia.org/ontology/genre
What is the name of a location in the pacific time zone;http://dbpedia.org/ontology/timeZone
What did aretha franklin compose?;http://dbpedia.org/ontology/writer
what's the name of an adventure video game;http://dbpedia.org/ontology/genre
what tv episodes has tawnia mckiernan directed;http://dbpedia.org/ontology/director
what types of game is jade empire;http://dbpedia.org/ontology/genre
What country was eleazer oswald born in;http://dbpedia.org/ontology/birthPlace
Who wrote the cruelest month;http://dbpedia.org/ontology/author
what position does ryoichi kurisawa play;http://dbpedia.org/ontology/position
Who was the writer of the film the devil wears prada (film)?;http://dbpedia.org/ontology/writer
whats the name of a former baseball pitcher;http://dbpedia.org/ontology/position
