question;predicate
Which genre of music is off the album love, war, and the ghost of whitey ford;http://dbpedia.org/ontology/genre
Where did washington irving pass away?;http://dbpedia.org/ontology/deathPlace
Who was born in 1932 in new york city;http://dbpedia.org/ontology/birthPlace
What time zone is Rochester in?;http://dbpedia.org/ontology/timeZone
What is the genre of the album this type of thinking (could do us in);http://dbpedia.org/ontology/genre
Name an art rock artist.;http://dbpedia.org/ontology/genre
what kind of album is a salty dog;http://dbpedia.org/ontology/genre
What is the genre of music made by the rattlesnake aces;http://dbpedia.org/ontology/genre
what is a pop music album released in 1993;http://dbpedia.org/ontology/genre
what style of music does thomas ring play;http://dbpedia.org/ontology/genre
What is an album of the genre merengue music?;http://dbpedia.org/ontology/genre
who was born in karlovy vary?;http://dbpedia.org/ontology/birthPlace
which basketball player was born in hill city;http://dbpedia.org/ontology/birthPlace
where was stan jolley born;http://dbpedia.org/ontology/birthPlace
where was walter silva born at?;http://dbpedia.org/ontology/birthPlace
Which type of music is on the album titled for every man;http://dbpedia.org/ontology/genre
which tropical place was thomas shadrach james born in?;http://dbpedia.org/ontology/birthPlace
Who was the lyricist from the song titled baby love;http://dbpedia.org/ontology/writer
where was cristian gabriel chavez born;http://dbpedia.org/ontology/birthPlace
who wrote the story of double face;http://dbpedia.org/ontology/writer
What type of music does kiros create;http://dbpedia.org/ontology/genre
what type of music does miho hatori make?;http://dbpedia.org/ontology/genre
Where was clint gosling born;http://dbpedia.org/ontology/birthPlace
in what time zone is los trujillos-gabaldon located;http://dbpedia.org/ontology/timeZone
What's the time zone in farmington township;http://dbpedia.org/ontology/timeZone
Which city broadcasts kvea radio;http://dbpedia.org/ontology/location
What genre of music does sergio mendes make?;http://dbpedia.org/ontology/genre
whats an example of a ragga album;http://dbpedia.org/ontology/genre
macpheadris-warner house is located in which state?;http://dbpedia.org/ontology/location
what is everson walls's place of birth?;http://dbpedia.org/ontology/birthPlace
What sort of music does doctors of madness play;http://dbpedia.org/ontology/genre
What is a composition by paul westerberg?;http://dbpedia.org/ontology/writer
What indian writer was born in india?;http://dbpedia.org/ontology/birthPlace
What genre is the album good health;http://dbpedia.org/ontology/genre
what game genre is contra 4?;http://dbpedia.org/ontology/genre
where was frithjof bergmann given birth;http://dbpedia.org/ontology/birthPlace
what country gives duleepsinhji his nationality;http://dbpedia.org/ontology/birthPlace
who was born in london;http://dbpedia.org/ontology/birthPlace
what city was dennis sherrill born in;http://dbpedia.org/ontology/birthPlace
what time zone is umm qasr located;http://dbpedia.org/ontology/timeZone
who was born in thiruvananthapuram;http://dbpedia.org/ontology/birthPlace
What is an example of a electronic dance music album?;http://dbpedia.org/ontology/genre
Name an album from the spoken word genre;http://dbpedia.org/ontology/genre
What genre of music is the album Laura Branigan?;http://dbpedia.org/ontology/genre
which city in ireland was sean finn born;http://dbpedia.org/ontology/birthPlace
What is a tourist attraction in manila?;http://dbpedia.org/ontology/location
what kind of music if featured in opera;http://dbpedia.org/ontology/genre
Name a person born in cleveland, ohio.;http://dbpedia.org/ontology/birthPlace
What is tor marius gromstad's birth place;http://dbpedia.org/ontology/birthPlace
which game is produced by adventure;http://dbpedia.org/ontology/genre
WHat type of video game is rocket ranger?;http://dbpedia.org/ontology/genre
what type of music is on the album winterwunderland;http://dbpedia.org/ontology/genre
what country is martin larsson from;http://dbpedia.org/ontology/birthPlace
Name a village in south cambridgeshire.;http://dbpedia.org/ontology/location
What type of game is domino master;http://dbpedia.org/ontology/genre
what type of music is animetal?;http://dbpedia.org/ontology/genre
what is the name of a person born in tokyo;http://dbpedia.org/ontology/birthPlace
which time zone does vestavia hills, alabama follow;http://dbpedia.org/ontology/timeZone
which country was grigory romanov born in;http://dbpedia.org/ontology/birthPlace
What's a track that steve hogarth wrote lyrics for;http://dbpedia.org/ontology/writer
What kind of music does lyle ritz play;http://dbpedia.org/ontology/genre
What kind of music is on the art of fingerstyle jazz guitar;http://dbpedia.org/ontology/genre
where was hussain al-shahristani's place of birth;http://dbpedia.org/ontology/birthPlace
what kind of music is on biograph (album)?;http://dbpedia.org/ontology/genre
who is an artist from the country pop genre?;http://dbpedia.org/ontology/genre
What country is krister henriksson originally from?;http://dbpedia.org/ontology/birthPlace
which nationality is daisy d'ora;http://dbpedia.org/ontology/birthPlace
which politician was born in banda aceh?;http://dbpedia.org/ontology/birthPlace
Who was born in Connecticut?;http://dbpedia.org/ontology/birthPlace
Which woman was born in harris county, texas?;http://dbpedia.org/ontology/birthPlace
which actor was born in wrexham?;http://dbpedia.org/ontology/birthPlace
where in the united states was lisa colagrossi born?;http://dbpedia.org/ontology/birthPlace
what type of music is you cross my path?;http://dbpedia.org/ontology/genre
What is a song written by lyricist robby krieger?;http://dbpedia.org/ontology/writer
where did clement comer clay breathe is last breath;http://dbpedia.org/ontology/deathPlace
what is a jazz album example?;http://dbpedia.org/ontology/genre
Which city was oliver dickinson born in;http://dbpedia.org/ontology/birthPlace
what is a five piece band from Perth that performs indie pop;http://dbpedia.org/ontology/genre
What kind of music is played on don't explain;http://dbpedia.org/ontology/genre
what artist makes dream pop music?;http://dbpedia.org/ontology/genre
Who's the writer behind dulcy;http://dbpedia.org/ontology/writer
Name a blues artist.;http://dbpedia.org/ontology/genre
"What type of music genre is ""Social Code""?";http://dbpedia.org/ontology/genre
what kind of music does jon josep snaebjornsson make?;http://dbpedia.org/ontology/genre
what genre is the artist sunn o)))?;http://dbpedia.org/ontology/genre
Name a grunge musician.;http://dbpedia.org/ontology/genre
what kind of music is cant slow down...when its live!;http://dbpedia.org/ontology/genre
Who composed warrior's dance?;http://dbpedia.org/ontology/writer
who wrote the script for the movie batman;http://dbpedia.org/ontology/writer
what kind of music did willie chambers play;http://dbpedia.org/ontology/genre
What netflix genre does the movie dark shadows belong to;http://dbpedia.org/ontology/genre
what person was born in allentown, pennsylvania;http://dbpedia.org/ontology/birthPlace
what type of music does etta jones make;http://dbpedia.org/ontology/genre
Who was born in tiflis governorate?;http://dbpedia.org/ontology/birthPlace
What is an album in the dance music genre?;http://dbpedia.org/ontology/genre
What is an example of a j-pop album?;http://dbpedia.org/ontology/genre
What kind of music is the complete studio recordings?;http://dbpedia.org/ontology/genre
who was born in giza;http://dbpedia.org/ontology/birthPlace
which nationality is sandra nashaat associated with;http://dbpedia.org/ontology/birthPlace
what type of music does major lance play;http://dbpedia.org/ontology/genre
which african poet is best known for spoken word?;http://dbpedia.org/ontology/genre
name a variety show;http://dbpedia.org/ontology/genre
which japanese singer was born in kochi;http://dbpedia.org/ontology/birthPlace
What as an album of the latin american music genre>;http://dbpedia.org/ontology/genre
who wrote the film young triffie?;http://dbpedia.org/ontology/writer
What kind of game is yu-gi-oh! the falsebound kingdom;http://dbpedia.org/ontology/genre
What is an example of a gothic rock album?;http://dbpedia.org/ontology/genre
what is a soul music album;http://dbpedia.org/ontology/genre
What genre is tales from the elvenpath;http://dbpedia.org/ontology/genre
what is one of alex james (musician)'s compositions;http://dbpedia.org/ontology/writer
what type of music does jerry horton create;http://dbpedia.org/ontology/genre
Where was mariusz kwiecien born;http://dbpedia.org/ontology/birthPlace
which song was written by robert palmer;http://dbpedia.org/ontology/writer
what is was the place of death of george caley;http://dbpedia.org/ontology/deathPlace
what genre is generation kill;http://dbpedia.org/ontology/genre
which actor was born in bonn?;http://dbpedia.org/ontology/birthPlace
what is the place of birth for mark koevermans;http://dbpedia.org/ontology/birthPlace
which genre of music does the artist boxer rebellion belong to?;http://dbpedia.org/ontology/genre
What's an example of a progressive rock album;http://dbpedia.org/ontology/genre
what kind of music is on highly evolved?;http://dbpedia.org/ontology/genre
Where did nickolas ashford die;http://dbpedia.org/ontology/deathPlace
where is bethel located?;http://dbpedia.org/ontology/location
what is the genre of the album liverpool 78;http://dbpedia.org/ontology/genre
Who was born in massachusetts;http://dbpedia.org/ontology/birthPlace
what musician performs christian rock;http://dbpedia.org/ontology/genre
what anime could be considered like an action film;http://dbpedia.org/ontology/genre
Who is a notable person that was born in munich;http://dbpedia.org/ontology/birthPlace
Which French city was hercules brabazon brabazon born in;http://dbpedia.org/ontology/birthPlace
Which genre of music is on the hope album;http://dbpedia.org/ontology/genre
what album is from the genre indie rock;http://dbpedia.org/ontology/genre
what person was born in  singapore;http://dbpedia.org/ontology/birthPlace
what type of computer video game is potty pigeon?;http://dbpedia.org/ontology/genre
what famous person was born in quincy;http://dbpedia.org/ontology/birthPlace
is ...for the kids alternative hip hop or rock;http://dbpedia.org/ontology/genre
Where was lucan born?;http://dbpedia.org/ontology/birthPlace
What is pablo andres gonzalez's nationality?;http://dbpedia.org/ontology/birthPlace
What is the name of a song written by nicki minaj?;http://dbpedia.org/ontology/writer
what genre is the video game lost word of jenny;http://dbpedia.org/ontology/genre
which male actor was born in budapest, hungary?;http://dbpedia.org/ontology/birthPlace
what types of music is second nature;http://dbpedia.org/ontology/genre
which ice hockey player was born in kuopio?;http://dbpedia.org/ontology/birthPlace
Who was born in London?;http://dbpedia.org/ontology/birthPlace
What is the name of the city where grigory petrovsky passed away?;http://dbpedia.org/ontology/deathPlace
What is an example of a pop rock album?;http://dbpedia.org/ontology/genre
What is a film that mike figgis has written?;http://dbpedia.org/ontology/writer
What's a lake within the fort apache indian reservation;http://dbpedia.org/ontology/location
what man was born in birmingham;http://dbpedia.org/ontology/birthPlace
which artists creates dance music;http://dbpedia.org/ontology/genre
Which album is a latin pop album>;http://dbpedia.org/ontology/genre
where did george w. p. hunt die;http://dbpedia.org/ontology/deathPlace
what is the name of an artist who makes indie rock music;http://dbpedia.org/ontology/genre
What is the name of a popular indie band;http://dbpedia.org/ontology/genre
What is the name of a model whose reality tv show is film in los angeles?;http://dbpedia.org/ontology/birthPlace
what is nick robinson's place of birth;http://dbpedia.org/ontology/birthPlace
where did mario pergolini take his first breath;http://dbpedia.org/ontology/birthPlace
which lyrics did burton cummings write;http://dbpedia.org/ontology/writer
In which location was robert shaw (conductor) born?;http://dbpedia.org/ontology/birthPlace
what is a rock music album?;http://dbpedia.org/ontology/genre
Where did erich neumann die;http://dbpedia.org/ontology/deathPlace
dancemania 6 belongs to which music genre?;http://dbpedia.org/ontology/genre
what album is am example of hard rock?;http://dbpedia.org/ontology/genre
which country was chris hill born;http://dbpedia.org/ontology/birthPlace
what type of music does the smiths make;http://dbpedia.org/ontology/genre
which specific kind of rock music is on imperial bedroom;http://dbpedia.org/ontology/genre
what are gangsta rap albums;http://dbpedia.org/ontology/genre
which american actress was born in chicago?;http://dbpedia.org/ontology/birthPlace
what kind of game is nba jam 2000?;http://dbpedia.org/ontology/genre
what kind of game is secret agent clank;http://dbpedia.org/ontology/genre
who was an important person born in new york city;http://dbpedia.org/ontology/birthPlace
who is a biathlete born in belley;http://dbpedia.org/ontology/birthPlace
what genre of music does grizzly bear (band) belong to?;http://dbpedia.org/ontology/genre
Where was nadia gamel born;http://dbpedia.org/ontology/birthPlace
What is the genre of the album let it break;http://dbpedia.org/ontology/genre
Where in brazil was bibi ferreira born;http://dbpedia.org/ontology/birthPlace
what city was letitia baldrige born in;http://dbpedia.org/ontology/birthPlace
what music does tablo produce?;http://dbpedia.org/ontology/genre
which country is st. joseph's catholic church located in?;http://dbpedia.org/ontology/location
where did juan pereda pass away;http://dbpedia.org/ontology/deathPlace
who composed i like it;http://dbpedia.org/ontology/writer
Name someone who was born in geneva;http://dbpedia.org/ontology/birthPlace
who was the composer for sorrow;http://dbpedia.org/ontology/writer
gottfried graf von bismarck-schonhausen  was born in what city in Germany;http://dbpedia.org/ontology/birthPlace
which city did jia hongsheng die;http://dbpedia.org/ontology/deathPlace
Where did bert barlow die;http://dbpedia.org/ontology/deathPlace
what is a tourist attraction in 1770, queensland;http://dbpedia.org/ontology/location
which city in france was francoise brion born in;http://dbpedia.org/ontology/birthPlace
What is igor fyodorovich letov classified as;http://dbpedia.org/ontology/genre
What genre is let it be me;http://dbpedia.org/ontology/genre
what is the genre of en-tact;http://dbpedia.org/ontology/genre
what is the cvg genre of doom (video game);http://dbpedia.org/ontology/genre
which country did donald s. harrington pass away;http://dbpedia.org/ontology/deathPlace
what city in texas was omar uresti born in;http://dbpedia.org/ontology/birthPlace
who directed the film the big bang;http://dbpedia.org/ontology/writer
What country does alain souchon belong to;http://dbpedia.org/ontology/birthPlace
what kind of music is paul staveley o'duffy famous for;http://dbpedia.org/ontology/genre
What school is located in hopkinsville?;http://dbpedia.org/ontology/location
what kind of music does the hold steady typically play;http://dbpedia.org/ontology/genre
what type of music does the brian jonestown massacre play?;http://dbpedia.org/ontology/genre
who is a rock music artist;http://dbpedia.org/ontology/genre
Which time zone is kaumakani, hawaii in ?;http://dbpedia.org/ontology/timeZone
what is the genre of the album descend into the absurd;http://dbpedia.org/ontology/genre
Which nation is Angel reyna from?;http://dbpedia.org/ontology/birthPlace
what type of music did 213 make;http://dbpedia.org/ontology/genre
which footballer was born in middlesbrough;http://dbpedia.org/ontology/birthPlace
What sort of show is taking the flak;http://dbpedia.org/ontology/genre
where was william john wainwright born;http://dbpedia.org/ontology/birthPlace
what is the place of death of earl rogers?;http://dbpedia.org/ontology/deathPlace
what is the genre of the album desire of the rhino king;http://dbpedia.org/ontology/genre
who was born in baghdad;http://dbpedia.org/ontology/birthPlace
What album is an example of hard rock?;http://dbpedia.org/ontology/genre
Who is someone born in muroran;http://dbpedia.org/ontology/birthPlace
which city was winifred nicholson born in;http://dbpedia.org/ontology/birthPlace
Where was neal c. wilson born?;http://dbpedia.org/ontology/birthPlace
who is a writer born in wimbledon;http://dbpedia.org/ontology/birthPlace
what kind of music is mothermania;http://dbpedia.org/ontology/genre
who wrote the story for big fat liar;http://dbpedia.org/ontology/writer
what is the location of francesco bianchi's death;http://dbpedia.org/ontology/deathPlace
what's the name of a band that plays death metal;http://dbpedia.org/ontology/genre
where was ilija mitic born;http://dbpedia.org/ontology/birthPlace
What genre is the main event video game?;http://dbpedia.org/ontology/genre
which genre is the album electronic eden;http://dbpedia.org/ontology/genre
Who was born in the netherlands?;http://dbpedia.org/ontology/birthPlace
where was brian priestman born;http://dbpedia.org/ontology/birthPlace
Name a person born in boise, idaho;http://dbpedia.org/ontology/birthPlace
Where was manuel doblado born;http://dbpedia.org/ontology/birthPlace
where in london did george edmund butler die?;http://dbpedia.org/ontology/deathPlace
what kind of music is phil roy known for;http://dbpedia.org/ontology/genre
Who wrote the lyrics to onna to otoko no lullaby game;http://dbpedia.org/ontology/writer
what kind of music is this is the sea;http://dbpedia.org/ontology/genre
what album is a type of rhythm and blues?;http://dbpedia.org/ontology/genre
Name an action game.;http://dbpedia.org/ontology/genre
Where was nuno santos born;http://dbpedia.org/ontology/birthPlace
What was the location of cesare giulio viola's death?;http://dbpedia.org/ontology/deathPlace
which indie rock artist originated in germany?;http://dbpedia.org/ontology/genre
what country is natalia pavlovna paley from;http://dbpedia.org/ontology/birthPlace
where was carey scurry born;http://dbpedia.org/ontology/birthPlace
Name an album from the genre rhythm and blues;http://dbpedia.org/ontology/genre
who is an artist that performs fingerstyle guitar  music;http://dbpedia.org/ontology/genre
What genre is future past;http://dbpedia.org/ontology/genre
what type of music does ida maria play;http://dbpedia.org/ontology/genre
where was jason davis born;http://dbpedia.org/ontology/birthPlace
Name a techno artist.;http://dbpedia.org/ontology/genre
what is an album in pop music;http://dbpedia.org/ontology/genre
what genre does patrick moraz classify under;http://dbpedia.org/ontology/genre
which person is known for being born in  new york city;http://dbpedia.org/ontology/birthPlace
Where was brian burke (ice hockey) born?;http://dbpedia.org/ontology/birthPlace
What is crooked i's genre;http://dbpedia.org/ontology/genre
what's a playstation exclusive racing game;http://dbpedia.org/ontology/genre
who is a musician born in detroit;http://dbpedia.org/ontology/birthPlace
what is osamu kobayashi's nationality?;http://dbpedia.org/ontology/birthPlace
Who is someone that was born in lucedale?;http://dbpedia.org/ontology/birthPlace
which city did jerry lynch die;http://dbpedia.org/ontology/deathPlace
what is buckner stith morris' place of birth;http://dbpedia.org/ontology/birthPlace
what kind of music is monochrome;http://dbpedia.org/ontology/genre
what kind of music does the wrecking make?;http://dbpedia.org/ontology/genre
What country is melissa mendez is a citizen of?;http://dbpedia.org/ontology/birthPlace
Name a person born in cairo.;http://dbpedia.org/ontology/birthPlace
where was giovanni antonio amadeo born;http://dbpedia.org/ontology/birthPlace
Where did lord hawke pass away;http://dbpedia.org/ontology/deathPlace
Which artist performs world music?;http://dbpedia.org/ontology/genre
what's the name of an actor who's from los angeles;http://dbpedia.org/ontology/birthPlace
what kind of music is on sowiesoso?;http://dbpedia.org/ontology/genre
which DJ was born in chicago;http://dbpedia.org/ontology/birthPlace
What's a city that uses eastern european time;http://dbpedia.org/ontology/timeZone
what kind of music does lil' mama sing;http://dbpedia.org/ontology/genre
Where was fernand cormon's place of birth?;http://dbpedia.org/ontology/birthPlace
what types of music is played by scott bradley;http://dbpedia.org/ontology/genre
Name a notable person who was born in buffalo, new york;http://dbpedia.org/ontology/birthPlace
What is the nationality of mael lepicier?;http://dbpedia.org/ontology/birthPlace
what kind of music is in the album inside job?;http://dbpedia.org/ontology/genre
What's an example of a shooter game;http://dbpedia.org/ontology/genre
Who is some that was born in the united states?;http://dbpedia.org/ontology/birthPlace
which songs has nicky wire written?;http://dbpedia.org/ontology/writer
what kind of punk music is banned in d.c.: bad brains greatest riffs;http://dbpedia.org/ontology/genre
where did arthur forbes gordon kilby die;http://dbpedia.org/ontology/deathPlace
what type of musical genre does  ron thal create;http://dbpedia.org/ontology/genre
what kind of game is ottomatic;http://dbpedia.org/ontology/genre
what is the time zone of almunge?;http://dbpedia.org/ontology/timeZone
what films have robert e. sherwood written?;http://dbpedia.org/ontology/writer
where was alex carrington born;http://dbpedia.org/ontology/birthPlace
Which netflix genre is rebus apart of?;http://dbpedia.org/ontology/genre
Where in the united states is jones motor company;http://dbpedia.org/ontology/location
what is located in the eastern european time zone?;http://dbpedia.org/ontology/timeZone
which city was kate hudson born;http://dbpedia.org/ontology/birthPlace
what is an alternative rock album;http://dbpedia.org/ontology/genre
Who was someone born in empoli;http://dbpedia.org/ontology/birthPlace
what law and order episode did blake masters write;http://dbpedia.org/ontology/writer
who wrote the room (film);http://dbpedia.org/ontology/writer
What sort of music was recorded for the album nikola & fattiglapparna;http://dbpedia.org/ontology/genre
where on earth did r. j. s. stevens die;http://dbpedia.org/ontology/deathPlace
What kind of music is en la madrugada se fue;http://dbpedia.org/ontology/genre
Where is yvonne gonzalez rogers from?;http://dbpedia.org/ontology/birthPlace
which artist performs the alternative hip hop genre;http://dbpedia.org/ontology/genre
what genre does the artist jimmy page play;http://dbpedia.org/ontology/genre
what kind of music does takka takka make?;http://dbpedia.org/ontology/genre
which guitarist was born in austin?;http://dbpedia.org/ontology/birthPlace
What type of music is jon oliva;http://dbpedia.org/ontology/genre
What genre of music is the album i robot?;http://dbpedia.org/ontology/genre
what music was composed by jesse harris;http://dbpedia.org/ontology/writer
Name a composition by jonas berggren;http://dbpedia.org/ontology/writer
what genre is the artist ant henson;http://dbpedia.org/ontology/genre
which album is in the genre alternative rock;http://dbpedia.org/ontology/genre
Who's a botanist born in friedberg;http://dbpedia.org/ontology/birthPlace
What is an example of a strategy video game?;http://dbpedia.org/ontology/genre
where was andres thomas born;http://dbpedia.org/ontology/birthPlace
What actor was born in lodz;http://dbpedia.org/ontology/birthPlace
Name a gothic rock album.;http://dbpedia.org/ontology/genre
what is eric himy's place of birth?;http://dbpedia.org/ontology/birthPlace
what artist makes psychedelic rock music?;http://dbpedia.org/ontology/genre
where was heinrich fuger born;http://dbpedia.org/ontology/birthPlace
What type of music is on the album in the midst of beauty;http://dbpedia.org/ontology/genre
which polynesian state was taufa'ao filise born in;http://dbpedia.org/ontology/birthPlace
what type of music is vis lollobrigida;http://dbpedia.org/ontology/genre
name an album in the hard rock genre?;http://dbpedia.org/ontology/genre
Where did karl amson joel die?;http://dbpedia.org/ontology/deathPlace
Who's a parliament member born in dublin;http://dbpedia.org/ontology/birthPlace
Where was oviedo born?;http://dbpedia.org/ontology/birthPlace
where was susan kohner born;http://dbpedia.org/ontology/birthPlace
What is the name of a trance music artist;http://dbpedia.org/ontology/genre
what types of gmae is amazing island;http://dbpedia.org/ontology/genre
which new york town was allen hulsey born in?;http://dbpedia.org/ontology/birthPlace
What is a song written by ian curtis?;http://dbpedia.org/ontology/writer
which scottish industrial center was ralph brand born in;http://dbpedia.org/ontology/birthPlace
which actor was born in oakland;http://dbpedia.org/ontology/birthPlace
Where was jose fidalgo born;http://dbpedia.org/ontology/birthPlace
What kind of music does aneta langerova make;http://dbpedia.org/ontology/genre
What genre does harvey shapiro perform;http://dbpedia.org/ontology/genre
what genre is the album the drums?;http://dbpedia.org/ontology/genre
What is the name of a town in the north american central time zone?;http://dbpedia.org/ontology/timeZone
what country is pierre messmer originally from;http://dbpedia.org/ontology/birthPlace
Which time zone is green grove located in;http://dbpedia.org/ontology/timeZone
what kind of video game is vietcong 2;http://dbpedia.org/ontology/genre
What is a film joris ivens wrote?;http://dbpedia.org/ontology/writer
Where was ilinka mitreva born;http://dbpedia.org/ontology/birthPlace
what kinds of music is created by jayson sherlock;http://dbpedia.org/ontology/genre
where in india did john alexander pass away?;http://dbpedia.org/ontology/deathPlace
