question;predicate
where specifically did robert smith pass away;http://dbpedia.org/ontology/deathPlace
What genre of artist is ben harper?;http://dbpedia.org/ontology/genre
what is a flight simulator game?;http://dbpedia.org/ontology/genre
Where was Sri Yukteswar giri born?;http://dbpedia.org/ontology/birthPlace
what district is in the indian standard time;http://dbpedia.org/ontology/timeZone
what kind of game is operation flashpoint: red river;http://dbpedia.org/ontology/genre
Where was john torreano born;http://dbpedia.org/ontology/birthPlace
Which city was edward stourton born in;http://dbpedia.org/ontology/birthPlace
What type of show is kapag may katwiran, ipaglaban mo!?;http://dbpedia.org/ontology/genre
what types of music is created by berlin;http://dbpedia.org/ontology/genre
what is fausto pocar's place of birth;http://dbpedia.org/ontology/birthPlace
Where did burt shotton cease his life?;http://dbpedia.org/ontology/deathPlace
tropics and meridians is what type of album;http://dbpedia.org/ontology/genre
Where was richard cantillon born;http://dbpedia.org/ontology/birthPlace
Who is a christian music artist;http://dbpedia.org/ontology/genre
what album is an example of vocal jazz?;http://dbpedia.org/ontology/genre
What style of music is adam duritz known for?;http://dbpedia.org/ontology/genre
what time zone is saint barthelemy in;http://dbpedia.org/ontology/timeZone
what kinds of tv program is private benjamin;http://dbpedia.org/ontology/genre
mihran damadian was born in this ancient capital, now named Istanbul.;http://dbpedia.org/ontology/birthPlace
what kinds of music is played by zoe badwi;http://dbpedia.org/ontology/genre
What kind of video game is the dog island;http://dbpedia.org/ontology/genre
this is a dance-pop album.;http://dbpedia.org/ontology/genre
what style of music does outlawz belong to?;http://dbpedia.org/ontology/genre
what kind of movie is the last dragon;http://dbpedia.org/ontology/genre
what type of music associated with the southern part of the Indian is performed by annamacharya;http://dbpedia.org/ontology/genre
where in the united states was damon runyon born?;http://dbpedia.org/ontology/birthPlace
What kind of music does stan levey make?;http://dbpedia.org/ontology/genre
whois an experimental music artist;http://dbpedia.org/ontology/genre
what kinds of music is played by hiroshi okubo;http://dbpedia.org/ontology/genre
what albums are rock music albums;http://dbpedia.org/ontology/genre
what is a composition composed by cole porter?;http://dbpedia.org/ontology/writer
what city and state was louise rosenblatt born in;http://dbpedia.org/ontology/birthPlace
What's an animated black comedy show;http://dbpedia.org/ontology/genre
where did andrew bennison die?;http://dbpedia.org/ontology/deathPlace
What genre of music is some of my best friends are djs;http://dbpedia.org/ontology/genre
what album plays rock music?;http://dbpedia.org/ontology/genre
what musical genre is city nights;http://dbpedia.org/ontology/genre
what Italian hammer is from palmanova;http://dbpedia.org/ontology/birthPlace
where in france was constantin guys' place of death?;http://dbpedia.org/ontology/deathPlace
whats the nationality of gerard depardieu;http://dbpedia.org/ontology/birthPlace
Name a rhythm and blues artist;http://dbpedia.org/ontology/genre
Which genre of music is on the album solo para fanaticos;http://dbpedia.org/ontology/genre
what film is written by heather hach?;http://dbpedia.org/ontology/writer
its the world gone crazy  is what music category;http://dbpedia.org/ontology/genre
What music genre is Ed Kuepper?;http://dbpedia.org/ontology/genre
what is the genre of the artist devil sold his soul;http://dbpedia.org/ontology/genre
What is krishna datt's place of birth?;http://dbpedia.org/ontology/birthPlace
what city is schandor kallosh from;http://dbpedia.org/ontology/birthPlace
Which city was richard holden in when he died;http://dbpedia.org/ontology/deathPlace
What time zone is leon in;http://dbpedia.org/ontology/timeZone
what type of game is shade: wrath of angels;http://dbpedia.org/ontology/genre
what city is located in north american central time zone;http://dbpedia.org/ontology/timeZone
where did l. m. shaw die;http://dbpedia.org/ontology/deathPlace
Which country was gudmundur steinarsson born in;http://dbpedia.org/ontology/birthPlace
where is goodyear airdock found;http://dbpedia.org/ontology/location
who was the lyricist of the composition driving the last spike;http://dbpedia.org/ontology/writer
what album is disco;http://dbpedia.org/ontology/genre
what kind of music is the album the undeveloped heart ep?;http://dbpedia.org/ontology/genre
who wrote the fly;http://dbpedia.org/ontology/writer
what type of music is the album earthshaker?;http://dbpedia.org/ontology/genre
What is the name of a notable person for manila;http://dbpedia.org/ontology/birthPlace
who was born in edmonton;http://dbpedia.org/ontology/birthPlace
what kind of show is $5 cover;http://dbpedia.org/ontology/genre
Name a person born in portland.;http://dbpedia.org/ontology/birthPlace
Where did mischa spoliansky die;http://dbpedia.org/ontology/deathPlace
Who's a comic book artist born in crossville, tennessee;http://dbpedia.org/ontology/birthPlace
WHat's an example of a heavy metal album;http://dbpedia.org/ontology/genre
Where did hugo fischer-koppe die;http://dbpedia.org/ontology/deathPlace
what city and state did norman schwarzkopf, jr. pass away in;http://dbpedia.org/ontology/deathPlace
what mystic and writer was born in mexico;http://dbpedia.org/ontology/birthPlace
what musical genre does damien moyal create;http://dbpedia.org/ontology/genre
whats an example of a soft rock album;http://dbpedia.org/ontology/genre
where in new york was bob guccione born in>;http://dbpedia.org/ontology/birthPlace
which album falls under the genre of jazz music;http://dbpedia.org/ontology/genre
what kind of metal is the album my kantele;http://dbpedia.org/ontology/genre
what kind of game is eragon;http://dbpedia.org/ontology/genre
What type of video game is world games;http://dbpedia.org/ontology/genre
what kind of music comprises live at londons talk of the town;http://dbpedia.org/ontology/genre
what country is james callaghan from;http://dbpedia.org/ontology/birthPlace
What kind of music is featured on always;http://dbpedia.org/ontology/genre
Who is an artist known for surf music?;http://dbpedia.org/ontology/genre
where was elizabeth cromwell born?;http://dbpedia.org/ontology/birthPlace
who wrote 10:30 p.m. summer;http://dbpedia.org/ontology/writer
name an example of an electro album.;http://dbpedia.org/ontology/genre
Where was jenny bailey born?;http://dbpedia.org/ontology/birthPlace
what kind of music is immortalized;http://dbpedia.org/ontology/genre
Who was born in El Paso?;http://dbpedia.org/ontology/birthPlace
where was the birthplace of christian holst;http://dbpedia.org/ontology/birthPlace
who was the writer of nutcase (film);http://dbpedia.org/ontology/writer
where was alvin e. roth given birth;http://dbpedia.org/ontology/birthPlace
Who is the composer of the answer me, my love?;http://dbpedia.org/ontology/writer
What is the birth place of kouhei kadono?;http://dbpedia.org/ontology/birthPlace
Who is a musician in the electronica genre?;http://dbpedia.org/ontology/genre
Where was antiflag born;http://dbpedia.org/ontology/birthPlace
Name a location within courbevoie;http://dbpedia.org/ontology/location
what is located in the central european time zone?;http://dbpedia.org/ontology/timeZone
what genre does robert plant perform in;http://dbpedia.org/ontology/genre
where was mika kanai born;http://dbpedia.org/ontology/birthPlace
where in india was laxminarayan pandey born;http://dbpedia.org/ontology/birthPlace
where was randy brown born;http://dbpedia.org/ontology/birthPlace
Name a PSP game in the strategy video game genre?;http://dbpedia.org/ontology/genre
where is ralph meeker's place of death;http://dbpedia.org/ontology/deathPlace
Which Filipino basketball player was born in Iloilo City?;http://dbpedia.org/ontology/birthPlace
what kind of music does pixie lott produce;http://dbpedia.org/ontology/genre
Which genre of music does dr. feelgood make;http://dbpedia.org/ontology/genre
What genre is johnny heartsman known for?;http://dbpedia.org/ontology/genre
what kind of music is kamal heer known for;http://dbpedia.org/ontology/genre
where was asmus jacob carstens born;http://dbpedia.org/ontology/deathPlace
what compositions have bruce springsteen made?;http://dbpedia.org/ontology/writer
who is a groove metal artist;http://dbpedia.org/ontology/genre
where was jalil zaland born;http://dbpedia.org/ontology/birthPlace
What sort of music was recorded for breathless;http://dbpedia.org/ontology/genre
What is the name of the dance music genre album?;http://dbpedia.org/ontology/genre
What country was eleazer oswald born in;http://dbpedia.org/ontology/birthPlace
What comedy entertainer was born in birmingham;http://dbpedia.org/ontology/birthPlace
what classification of music is moodymann;http://dbpedia.org/ontology/genre
who was born in manteca;http://dbpedia.org/ontology/birthPlace
which town was dianne pilkington born in;http://dbpedia.org/ontology/birthPlace
where was basil twist born?;http://dbpedia.org/ontology/birthPlace
Who wrote the story for the penal colony?;http://dbpedia.org/ontology/writer
which j-pop artist started out in 2003?;http://dbpedia.org/ontology/genre
What rock music album was released by a punk rock English band?;http://dbpedia.org/ontology/genre
Who was born in the united states;http://dbpedia.org/ontology/birthPlace
Where is craig borten from;http://dbpedia.org/ontology/birthPlace
which music format does envy play?;http://dbpedia.org/ontology/genre
Name a composition by ritchie blackmore;http://dbpedia.org/ontology/writer
What's a pop rock album released by the bee gees;http://dbpedia.org/ontology/genre
Ultra Blue is known for which genre?;http://dbpedia.org/ontology/genre
is black holes and revelations electronica or classical;http://dbpedia.org/ontology/genre
In which category does the video game silent hill 3 belong to?;http://dbpedia.org/ontology/genre
where did richard quine pass away;http://dbpedia.org/ontology/deathPlace
who was born in brockley;http://dbpedia.org/ontology/birthPlace
who was born in ogden;http://dbpedia.org/ontology/birthPlace
in what city did heinrich limpricht die;http://dbpedia.org/ontology/deathPlace
who is a famous math rock artist;http://dbpedia.org/ontology/genre
what island is mark isip from;http://dbpedia.org/ontology/birthPlace
Where was caressa savage born;http://dbpedia.org/ontology/birthPlace
where did joe wagner pass;http://dbpedia.org/ontology/deathPlace
what time zone is hartford in;http://dbpedia.org/ontology/timeZone
Where was princess margarita of leiningen born;http://dbpedia.org/ontology/birthPlace
which city was garrett mason born;http://dbpedia.org/ontology/birthPlace
What is the genre of the album beautiful road?;http://dbpedia.org/ontology/genre
what types of music is diadem of 12 stars;http://dbpedia.org/ontology/genre
what is the name of an alternative rock artist from japan;http://dbpedia.org/ontology/genre
what is the name of a location found in the north american central time zone;http://dbpedia.org/ontology/timeZone
what album has alternative rock;http://dbpedia.org/ontology/genre
What is the name of a song whos lyrics were written by robby krieger;http://dbpedia.org/ontology/writer
who is a rhythm and blues artist?;http://dbpedia.org/ontology/genre
What person was born in Philadelphia?;http://dbpedia.org/ontology/birthPlace
what genre is the album summon in thunder;http://dbpedia.org/ontology/genre
what is the time zone of destin, florida;http://dbpedia.org/ontology/timeZone
Name someone born in england;http://dbpedia.org/ontology/birthPlace
Name a person born in aurangabad.;http://dbpedia.org/ontology/birthPlace
what kinds of tv program is ben and hollys little kingdom;http://dbpedia.org/ontology/genre
Where was jb gill born;http://dbpedia.org/ontology/birthPlace
what capital of mongolia did jambyn batmonkh die in;http://dbpedia.org/ontology/deathPlace
what kind of music is the twilight sad;http://dbpedia.org/ontology/genre
Where is lock no. 1, north new river canal in florida;http://dbpedia.org/ontology/location
where is the green-meldrim house located?;http://dbpedia.org/ontology/location
where was bonar law  born;http://dbpedia.org/ontology/birthPlace
did emil stang die in oslo or helsinki;http://dbpedia.org/ontology/deathPlace
what kind of genre is batman forever: music from the motion picture;http://dbpedia.org/ontology/genre
who was born in new orleans;http://dbpedia.org/ontology/birthPlace
what game is has a construction and management simulation;http://dbpedia.org/ontology/genre
who are alternative rock artists;http://dbpedia.org/ontology/genre
who is the lyricist of soldier;http://dbpedia.org/ontology/writer
In which country was alita roman birthed?;http://dbpedia.org/ontology/birthPlace
shoegazing is a genre that classifies what album?;http://dbpedia.org/ontology/genre
What is the genre of music that phil chen falls under?;http://dbpedia.org/ontology/genre
Who is a folk music artist from bosnia;http://dbpedia.org/ontology/genre
who wrote the lyrics for glad to be gay?;http://dbpedia.org/ontology/writer
name a rock music album;http://dbpedia.org/ontology/genre
Name an artist know for pop punk;http://dbpedia.org/ontology/genre
who was born in chicago?;http://dbpedia.org/ontology/birthPlace
who wrote the film oldboy;http://dbpedia.org/ontology/writer
What genre of music is on the album kingsize;http://dbpedia.org/ontology/genre
What kind of music does honeymoon suite record?;http://dbpedia.org/ontology/genre
who was a pitcher for the reds and from st. johnsbury;http://dbpedia.org/ontology/birthPlace
Who was born in England?;http://dbpedia.org/ontology/birthPlace
who is the story of a far off place accredited to;http://dbpedia.org/ontology/writer
where did albert b. fall die;http://dbpedia.org/ontology/deathPlace
what type of game is the messenger?;http://dbpedia.org/ontology/genre
What genre is letlive?;http://dbpedia.org/ontology/genre
what soccer player was born in nigeria;http://dbpedia.org/ontology/birthPlace
What type of album is mocean?;http://dbpedia.org/ontology/genre
what country is thorsten kaye from;http://dbpedia.org/ontology/birthPlace
What kind of music is the album children of the future?;http://dbpedia.org/ontology/genre
Who was the composer of stone gossard?;http://dbpedia.org/ontology/writer
in which italian city is vanna brosio from;http://dbpedia.org/ontology/birthPlace
WHo is an experimental rock artist;http://dbpedia.org/ontology/genre
where did melanie chisholm come from?;http://dbpedia.org/ontology/birthPlace
What was the film story credits done by dean koontz;http://dbpedia.org/ontology/writer
what genre of music does jimmy james create;http://dbpedia.org/ontology/genre
What is the name of the town located in the mountain time zone?;http://dbpedia.org/ontology/timeZone
Who makes pop music;http://dbpedia.org/ontology/genre
what is the name of someone born in izmail;http://dbpedia.org/ontology/birthPlace
What kind of music is featured on please don't touch!;http://dbpedia.org/ontology/genre
what kind of music does wendy melvoin make;http://dbpedia.org/ontology/genre
what is a progressive metal album?;http://dbpedia.org/ontology/genre
which nation in europe does piotr petasz belong ti?;http://dbpedia.org/ontology/birthPlace
which time zone is sharon in;http://dbpedia.org/ontology/timeZone
what kind of music does yukihiro play;http://dbpedia.org/ontology/genre
Where was cara-beth burnside born;http://dbpedia.org/ontology/birthPlace
Who was a rapper who performed gangsta rap?;http://dbpedia.org/ontology/genre
where was frank heinemann born;http://dbpedia.org/ontology/birthPlace
what kind of video game is freelancer?;http://dbpedia.org/ontology/genre
what country capital was  william j. howell born;http://dbpedia.org/ontology/birthPlace
what genre of software is recuva;http://dbpedia.org/ontology/genre
Who wrote for the film titled the dark redemption;http://dbpedia.org/ontology/writer
Name a person born in Bangor.;http://dbpedia.org/ontology/birthPlace
Who's a senator born in paris;http://dbpedia.org/ontology/birthPlace
In what city and state is paseo ymca located;http://dbpedia.org/ontology/location
what kinds of videogame is zendoku;http://dbpedia.org/ontology/genre
what was camil petrescu's birthplace;http://dbpedia.org/ontology/birthPlace
What country is aleksander bardini from?;http://dbpedia.org/ontology/birthPlace
what genre of music does sam taylor play in?;http://dbpedia.org/ontology/genre
What is the place of death of carmen scarpitta;http://dbpedia.org/ontology/deathPlace
What type of music is the album kisou?;http://dbpedia.org/ontology/genre
Which genre of music is gary hoey known for?;http://dbpedia.org/ontology/genre
What is a university contained within bandar sunway?;http://dbpedia.org/ontology/location
what kind of music is on victory road to the king of neo visual rock?;http://dbpedia.org/ontology/genre
what kind of music is on the best of type o negative;http://dbpedia.org/ontology/genre
where in California was don francis born;http://dbpedia.org/ontology/birthPlace
what type of software is virtuoso universal server;http://dbpedia.org/ontology/genre
In what city was wolfgang pauli born?;http://dbpedia.org/ontology/birthPlace
which city in illinois was jay rosenberg born in;http://dbpedia.org/ontology/birthPlace
Where was Olivier Da Lage born?;http://dbpedia.org/ontology/birthPlace
what bob dylan songs did he write;http://dbpedia.org/ontology/writer
Where was donovan simmonds's place of birth?;http://dbpedia.org/ontology/birthPlace
what is regina ezera's place of death?;http://dbpedia.org/ontology/deathPlace
star trek: deep space nine: dominion wars is what type of video game?;http://dbpedia.org/ontology/genre
where was  paulo maluf born;http://dbpedia.org/ontology/birthPlace
which genre is viva! hysteria;http://dbpedia.org/ontology/genre
Who would be labeled a cool jazz artist;http://dbpedia.org/ontology/genre
what lyrics did lawrence gowan write;http://dbpedia.org/ontology/writer
where did prospero alpini die;http://dbpedia.org/ontology/deathPlace
Who is a musician born in boston;http://dbpedia.org/ontology/birthPlace
Where was gemini ganesan born?;http://dbpedia.org/ontology/birthPlace
antonio guterres is a citizen of what nation?;http://dbpedia.org/ontology/birthPlace
What is the genre of the tv program spawn;http://dbpedia.org/ontology/genre
where in new york did harry h. wellington die;http://dbpedia.org/ontology/deathPlace
what kind of music is on singer of sad songs?;http://dbpedia.org/ontology/genre
what types of music is played in jimmarcus;http://dbpedia.org/ontology/genre
Who was born in gabrovo?;http://dbpedia.org/ontology/birthPlace
what is the name where  josef minsch was born;http://dbpedia.org/ontology/birthPlace
what kind of music did the expendables make?;http://dbpedia.org/ontology/genre
what is a pop music album;http://dbpedia.org/ontology/genre
what kind of music does dope play;http://dbpedia.org/ontology/genre
form what northern  region of France is etienne bacrot from;http://dbpedia.org/ontology/birthPlace
where in the Netherlands was bette franke born?;http://dbpedia.org/ontology/birthPlace
What type of rock is recorded on the kitchen tapes;http://dbpedia.org/ontology/genre
which time zone is used in east new sarajevo;http://dbpedia.org/ontology/timeZone
who was born in nashville?;http://dbpedia.org/ontology/birthPlace
what album is of grunge genre;http://dbpedia.org/ontology/genre
what type of music does paul moak perform;http://dbpedia.org/ontology/genre
what is the genre of anthology;http://dbpedia.org/ontology/genre
What is the genre of music by 4minute?;http://dbpedia.org/ontology/genre
for how much longer do we tolerate mass murder? is of which musical genre?;http://dbpedia.org/ontology/genre
what's the name of a place in the hamptons;http://dbpedia.org/ontology/location
Name a pop rock album.;http://dbpedia.org/ontology/genre
what is gustavo becerra-schmidt place of death;http://dbpedia.org/ontology/deathPlace
where is nagi nodas birth place;http://dbpedia.org/ontology/birthPlace
What type of music is on the crush tour album;http://dbpedia.org/ontology/genre
where was andrea masi born;http://dbpedia.org/ontology/birthPlace
what type of music is the artist sex clark five known for;http://dbpedia.org/ontology/genre
what genre of music was the album lunacy released in?;http://dbpedia.org/ontology/genre
what city in Michigan did lord byron die;http://dbpedia.org/ontology/deathPlace
What time zone is friendswood, texas in;http://dbpedia.org/ontology/timeZone
what kind of music is the album mockingbird;http://dbpedia.org/ontology/genre
where in the united states was lucia mcculloch born at?;http://dbpedia.org/ontology/birthPlace
Name an album in the reggae genre.;http://dbpedia.org/ontology/genre
which time zones is vici, oklahoma located in?;http://dbpedia.org/ontology/timeZone
which city did bert andrews pass away in?;http://dbpedia.org/ontology/deathPlace
what is the name of a blues-rock album;http://dbpedia.org/ontology/genre
Where is Kenneth F. Simpson's place of birth?;http://dbpedia.org/ontology/birthPlace
where was fredrik skagen born;http://dbpedia.org/ontology/birthPlace
which painter was born in arezzo?;http://dbpedia.org/ontology/birthPlace
who was the lyricist for the song gold;http://dbpedia.org/ontology/writer
what album is gangsta rap?;http://dbpedia.org/ontology/genre
Which country was robert teah from;http://dbpedia.org/ontology/birthPlace
Where was nosson tzvi finkel born;http://dbpedia.org/ontology/birthPlace
what kinds of music is used by bloodhorse;http://dbpedia.org/ontology/genre
what is the genre of the magician's private library;http://dbpedia.org/ontology/genre
where was dejan borovnjak born;http://dbpedia.org/ontology/birthPlace
what classification of music is shabir;http://dbpedia.org/ontology/genre
where was lou stringer born;http://dbpedia.org/ontology/birthPlace
what is ed palmquist's place of death?;http://dbpedia.org/ontology/deathPlace
what genre of music does from zero play?;http://dbpedia.org/ontology/genre
What is the name of a real-time strategy hame;http://dbpedia.org/ontology/genre
what type of music is this present darkness?;http://dbpedia.org/ontology/genre
what type of computer video game is langrisser v: the end of legend;http://dbpedia.org/ontology/genre
what city is marek walczewski from;http://dbpedia.org/ontology/deathPlace
What was the genre of labyrinth: the computer game?;http://dbpedia.org/ontology/genre
where is the birthplace of joseph proust;http://dbpedia.org/ontology/birthPlace
what is located in utc+-00:00?;http://dbpedia.org/ontology/timeZone
what location is in the eastern european time zone;http://dbpedia.org/ontology/timeZone
what was albert pearson's place of death;http://dbpedia.org/ontology/deathPlace
what style of music is suck;http://dbpedia.org/ontology/genre
what genre of music does syren belong to?;http://dbpedia.org/ontology/genre
what is a brazilian popular music album;http://dbpedia.org/ontology/genre
where was ferenc szabo born at?;http://dbpedia.org/ontology/birthPlace
what is in tresco, isles of scilly?;http://dbpedia.org/ontology/location
which genre is associated with appalachian incantation;http://dbpedia.org/ontology/genre
what type of music does sukima switch make?;http://dbpedia.org/ontology/genre
where did kim nam-il originate from;http://dbpedia.org/ontology/birthPlace
where did michael braun pass away;http://dbpedia.org/ontology/deathPlace
What is the name of a game show?;http://dbpedia.org/ontology/genre
what is the name of someone born in port hope, ontario;http://dbpedia.org/ontology/birthPlace
what kind of album is jailhouse rock?;http://dbpedia.org/ontology/genre
what movie did carlos velo write;http://dbpedia.org/ontology/writer
Where is michael steven buble from?;http://dbpedia.org/ontology/birthPlace
what time zone is humboldt based in;http://dbpedia.org/ontology/timeZone
what was john oconnell's place of death;http://dbpedia.org/ontology/deathPlace
what type of music is die happy;http://dbpedia.org/ontology/genre
"What genre is ""Mephisto Odyssey""?";http://dbpedia.org/ontology/genre
what city does kfor-tv produce;http://dbpedia.org/ontology/location
What lyrics did John Oates write?;http://dbpedia.org/ontology/writer
where was jose llorens echevarria born;http://dbpedia.org/ontology/birthPlace
what's a jazz fusion by pierre moerlen's gong;http://dbpedia.org/ontology/genre
What is the genre of the game tak and the power of juju;http://dbpedia.org/ontology/genre
what is a neoclassical metal artist?;http://dbpedia.org/ontology/genre
what R&B music group produced pop music;http://dbpedia.org/ontology/genre
which broad category would the suite life of zack and cody fit under genre-wise;http://dbpedia.org/ontology/genre
What is the name of a fighting game;http://dbpedia.org/ontology/genre
what is esqueritas birth place;http://dbpedia.org/ontology/birthPlace
what type of music does tim rose make;http://dbpedia.org/ontology/genre
what country is juan arango from;http://dbpedia.org/ontology/birthPlace
which country is pongsak pongsuwan from;http://dbpedia.org/ontology/birthPlace
What is a name of a strategy video game?;http://dbpedia.org/ontology/genre
Who was born in johannesburg?;http://dbpedia.org/ontology/birthPlace
Where was j. n. williamson birthed;http://dbpedia.org/ontology/birthPlace
is captiva christian rock or classical;http://dbpedia.org/ontology/genre
"What type of film genre is ""World War II in HD Coulour""?";http://dbpedia.org/ontology/genre
what can be found in cambridge;http://dbpedia.org/ontology/location
what is the time zone of the roseville township;http://dbpedia.org/ontology/timeZone
What kind of music is a complete ~all singles~;http://dbpedia.org/ontology/genre
